tweet_id,timestamp,source,text,expanded_urls,rating,name,date,day,dog_stage,retweet_count,favorite_count,jpg_url,img_num,prediction_order,prediction,confidence,dog
892420643555336193,2017-08-01 16:23:56,Twitter for iPhone,This is Phineas. He's a mystical boy. Only ever appears in the hole of a donut. 13/10,https://twitter.com/dog_rates/status/892420643555336193/photo/1,13.0,Phineas,08-01-2017,1,unknown,8008,37333,https://pbs.twimg.com/media/DGKD1-bXoAAIAUK.jpg,1,1,Orange,0.0970486,False
892420643555336193,2017-08-01 16:23:56,Twitter for iPhone,This is Phineas. He's a mystical boy. Only ever appears in the hole of a donut. 13/10,https://twitter.com/dog_rates/status/892420643555336193/photo/1,13.0,Phineas,08-01-2017,1,unknown,8008,37333,https://pbs.twimg.com/media/DGKD1-bXoAAIAUK.jpg,1,2,Bagel,0.08585110000000001,False
892420643555336193,2017-08-01 16:23:56,Twitter for iPhone,This is Phineas. He's a mystical boy. Only ever appears in the hole of a donut. 13/10,https://twitter.com/dog_rates/status/892420643555336193/photo/1,13.0,Phineas,08-01-2017,1,unknown,8008,37333,https://pbs.twimg.com/media/DGKD1-bXoAAIAUK.jpg,1,3,Banana,0.07611,False
892177421306343426,2017-08-01 00:17:27,Twitter for iPhone,"This is Tilly. She's just checking pup on you. Hopes you're doing ok. If not, she's available for pats, snugs, boops, the whole bit. 13/10",https://twitter.com/dog_rates/status/892177421306343426/photo/1,13.0,Tilly,08-01-2017,1,unknown,5940,32088,https://pbs.twimg.com/media/DGGmoV4XsAAUL6n.jpg,1,1,Chihuahua,0.323581,True
892177421306343426,2017-08-01 00:17:27,Twitter for iPhone,"This is Tilly. She's just checking pup on you. Hopes you're doing ok. If not, she's available for pats, snugs, boops, the whole bit. 13/10",https://twitter.com/dog_rates/status/892177421306343426/photo/1,13.0,Tilly,08-01-2017,1,unknown,5940,32088,https://pbs.twimg.com/media/DGGmoV4XsAAUL6n.jpg,1,2,Pekinese,0.0906465,True
892177421306343426,2017-08-01 00:17:27,Twitter for iPhone,"This is Tilly. She's just checking pup on you. Hopes you're doing ok. If not, she's available for pats, snugs, boops, the whole bit. 13/10",https://twitter.com/dog_rates/status/892177421306343426/photo/1,13.0,Tilly,08-01-2017,1,unknown,5940,32088,https://pbs.twimg.com/media/DGGmoV4XsAAUL6n.jpg,1,3,Papillon,0.0689569,True
891815181378084864,2017-07-31 00:18:03,Twitter for iPhone,This is Archie. He is a rare Norwegian Pouncing Corgo. Lives in the tall grass. You never know when one may strike. 12/10,https://twitter.com/dog_rates/status/891815181378084864/photo/1,12.0,Archie,07-31-2017,0,unknown,3928,24188,https://pbs.twimg.com/media/DGBdLU1WsAANxJ9.jpg,1,1,Chihuahua,0.716012,True
891815181378084864,2017-07-31 00:18:03,Twitter for iPhone,This is Archie. He is a rare Norwegian Pouncing Corgo. Lives in the tall grass. You never know when one may strike. 12/10,https://twitter.com/dog_rates/status/891815181378084864/photo/1,12.0,Archie,07-31-2017,0,unknown,3928,24188,https://pbs.twimg.com/media/DGBdLU1WsAANxJ9.jpg,1,2,Malamute,0.078253,True
891815181378084864,2017-07-31 00:18:03,Twitter for iPhone,This is Archie. He is a rare Norwegian Pouncing Corgo. Lives in the tall grass. You never know when one may strike. 12/10,https://twitter.com/dog_rates/status/891815181378084864/photo/1,12.0,Archie,07-31-2017,0,unknown,3928,24188,https://pbs.twimg.com/media/DGBdLU1WsAANxJ9.jpg,1,3,Kelpie,0.0313789,True
891689557279858688,2017-07-30 15:58:51,Twitter for iPhone,This is Darla. She commenced a snooze mid meal. 13/10 happens to the best of us,https://twitter.com/dog_rates/status/891689557279858688/photo/1,13.0,Darla,07-30-2017,6,unknown,8167,40635,https://pbs.twimg.com/media/DF_q7IAWsAEuuN8.jpg,1,1,Paper Towel,0.17027799999999998,False
891689557279858688,2017-07-30 15:58:51,Twitter for iPhone,This is Darla. She commenced a snooze mid meal. 13/10 happens to the best of us,https://twitter.com/dog_rates/status/891689557279858688/photo/1,13.0,Darla,07-30-2017,6,unknown,8167,40635,https://pbs.twimg.com/media/DF_q7IAWsAEuuN8.jpg,1,2,Labrador Retriever,0.168086,True
891689557279858688,2017-07-30 15:58:51,Twitter for iPhone,This is Darla. She commenced a snooze mid meal. 13/10 happens to the best of us,https://twitter.com/dog_rates/status/891689557279858688/photo/1,13.0,Darla,07-30-2017,6,unknown,8167,40635,https://pbs.twimg.com/media/DF_q7IAWsAEuuN8.jpg,1,3,Spatula,0.0408359,False
891327558926688256,2017-07-29 16:00:24,Twitter for iPhone,"This is Franklin. He would like you to stop calling him ""cute."" He is a very fierce shark and should be respected as such. 12/10 #BarkWeek","https://twitter.com/dog_rates/status/891327558926688256/photo/1,https://twitter.com/dog_rates/status/891327558926688256/photo/1",12.0,Franklin,07-29-2017,5,unknown,8848,38867,https://pbs.twimg.com/media/DF6hr6BUMAAzZgT.jpg,2,1,Basset,0.555712,True
891327558926688256,2017-07-29 16:00:24,Twitter for iPhone,"This is Franklin. He would like you to stop calling him ""cute."" He is a very fierce shark and should be respected as such. 12/10 #BarkWeek","https://twitter.com/dog_rates/status/891327558926688256/photo/1,https://twitter.com/dog_rates/status/891327558926688256/photo/1",12.0,Franklin,07-29-2017,5,unknown,8848,38867,https://pbs.twimg.com/media/DF6hr6BUMAAzZgT.jpg,2,2,English Springer,0.22577,True
891327558926688256,2017-07-29 16:00:24,Twitter for iPhone,"This is Franklin. He would like you to stop calling him ""cute."" He is a very fierce shark and should be respected as such. 12/10 #BarkWeek","https://twitter.com/dog_rates/status/891327558926688256/photo/1,https://twitter.com/dog_rates/status/891327558926688256/photo/1",12.0,Franklin,07-29-2017,5,unknown,8848,38867,https://pbs.twimg.com/media/DF6hr6BUMAAzZgT.jpg,2,3,German Short Haired Pointer,0.175219,True
891087950875897856,2017-07-29 00:08:17,Twitter for iPhone,Here we have a majestic great white breaching off South Africa's coast. Absolutely h*ckin breathtaking. 13/10 (IG: tucker_marlo) #BarkWeek,https://twitter.com/dog_rates/status/891087950875897856/photo/1,13.0,dog doe,07-29-2017,5,unknown,2944,19537,https://pbs.twimg.com/media/DF3HwyEWsAABqE6.jpg,1,1,Chesapeake Bay Retriever,0.425595,True
891087950875897856,2017-07-29 00:08:17,Twitter for iPhone,Here we have a majestic great white breaching off South Africa's coast. Absolutely h*ckin breathtaking. 13/10 (IG: tucker_marlo) #BarkWeek,https://twitter.com/dog_rates/status/891087950875897856/photo/1,13.0,dog doe,07-29-2017,5,unknown,2944,19537,https://pbs.twimg.com/media/DF3HwyEWsAABqE6.jpg,1,2,Irish Terrier,0.116317,True
891087950875897856,2017-07-29 00:08:17,Twitter for iPhone,Here we have a majestic great white breaching off South Africa's coast. Absolutely h*ckin breathtaking. 13/10 (IG: tucker_marlo) #BarkWeek,https://twitter.com/dog_rates/status/891087950875897856/photo/1,13.0,dog doe,07-29-2017,5,unknown,2944,19537,https://pbs.twimg.com/media/DF3HwyEWsAABqE6.jpg,1,3,Indian Elephant,0.07690219999999999,False
890971913173991426,2017-07-28 16:27:12,Twitter for iPhone,"Meet Jax. He enjoys ice cream so much he gets nervous around it. 13/10 help Jax enjoy more things by clicking below
","https://gofundme.com/ydvmve-surgery-for-jax,https://twitter.com/dog_rates/status/890971913173991426/photo/1",13.0,Jax,07-28-2017,4,unknown,1946,11406,https://pbs.twimg.com/media/DF1eOmZXUAALUcq.jpg,1,1,Appenzeller,0.34170300000000003,True
890971913173991426,2017-07-28 16:27:12,Twitter for iPhone,"Meet Jax. He enjoys ice cream so much he gets nervous around it. 13/10 help Jax enjoy more things by clicking below
","https://gofundme.com/ydvmve-surgery-for-jax,https://twitter.com/dog_rates/status/890971913173991426/photo/1",13.0,Jax,07-28-2017,4,unknown,1946,11406,https://pbs.twimg.com/media/DF1eOmZXUAALUcq.jpg,1,2,Border Collie,0.199287,True
890971913173991426,2017-07-28 16:27:12,Twitter for iPhone,"Meet Jax. He enjoys ice cream so much he gets nervous around it. 13/10 help Jax enjoy more things by clicking below
","https://gofundme.com/ydvmve-surgery-for-jax,https://twitter.com/dog_rates/status/890971913173991426/photo/1",13.0,Jax,07-28-2017,4,unknown,1946,11406,https://pbs.twimg.com/media/DF1eOmZXUAALUcq.jpg,1,3,Ice Lolly,0.193548,False
890729181411237888,2017-07-28 00:22:40,Twitter for iPhone,When you watch your owner call another dog a good boy but then they turn back to you and say you're a great boy. 13/10,"https://twitter.com/dog_rates/status/890729181411237888/photo/1,https://twitter.com/dog_rates/status/890729181411237888/photo/1",13.0,dog doe,07-28-2017,4,unknown,17841,62945,https://pbs.twimg.com/media/DFyBahAVwAAhUTd.jpg,2,1,Pomeranian,0.566142,True
890729181411237888,2017-07-28 00:22:40,Twitter for iPhone,When you watch your owner call another dog a good boy but then they turn back to you and say you're a great boy. 13/10,"https://twitter.com/dog_rates/status/890729181411237888/photo/1,https://twitter.com/dog_rates/status/890729181411237888/photo/1",13.0,dog doe,07-28-2017,4,unknown,17841,62945,https://pbs.twimg.com/media/DFyBahAVwAAhUTd.jpg,2,2,Eskimo Dog,0.17840599999999998,True
890729181411237888,2017-07-28 00:22:40,Twitter for iPhone,When you watch your owner call another dog a good boy but then they turn back to you and say you're a great boy. 13/10,"https://twitter.com/dog_rates/status/890729181411237888/photo/1,https://twitter.com/dog_rates/status/890729181411237888/photo/1",13.0,dog doe,07-28-2017,4,unknown,17841,62945,https://pbs.twimg.com/media/DFyBahAVwAAhUTd.jpg,2,3,Pembroke,0.0765069,True
890609185150312448,2017-07-27 16:25:51,Twitter for iPhone,This is Zoey. She doesn't want to be one of the scary sharks. Just wants to be a snuggly pettable boatpet. 13/10 #BarkWeek,https://twitter.com/dog_rates/status/890609185150312448/photo/1,13.0,Zoey,07-27-2017,3,unknown,4044,26870,https://pbs.twimg.com/media/DFwUU__XcAEpyXI.jpg,1,1,Irish Terrier,0.487574,True
890609185150312448,2017-07-27 16:25:51,Twitter for iPhone,This is Zoey. She doesn't want to be one of the scary sharks. Just wants to be a snuggly pettable boatpet. 13/10 #BarkWeek,https://twitter.com/dog_rates/status/890609185150312448/photo/1,13.0,Zoey,07-27-2017,3,unknown,4044,26870,https://pbs.twimg.com/media/DFwUU__XcAEpyXI.jpg,1,2,Irish Setter,0.193054,True
890609185150312448,2017-07-27 16:25:51,Twitter for iPhone,This is Zoey. She doesn't want to be one of the scary sharks. Just wants to be a snuggly pettable boatpet. 13/10 #BarkWeek,https://twitter.com/dog_rates/status/890609185150312448/photo/1,13.0,Zoey,07-27-2017,3,unknown,4044,26870,https://pbs.twimg.com/media/DFwUU__XcAEpyXI.jpg,1,3,Chesapeake Bay Retriever,0.118184,True
890240255349198849,2017-07-26 15:59:51,Twitter for iPhone,This is Cassie. She is a college pup. Studying international doggo communication and stick theory. 14/10 so elegant much sophisticate,https://twitter.com/dog_rates/status/890240255349198849/photo/1,14.0,Cassie,07-26-2017,2,doggo,6966,30795,https://pbs.twimg.com/media/DFrEyVuW0AAO3t9.jpg,1,1,Pembroke,0.511319,True
890240255349198849,2017-07-26 15:59:51,Twitter for iPhone,This is Cassie. She is a college pup. Studying international doggo communication and stick theory. 14/10 so elegant much sophisticate,https://twitter.com/dog_rates/status/890240255349198849/photo/1,14.0,Cassie,07-26-2017,2,doggo,6966,30795,https://pbs.twimg.com/media/DFrEyVuW0AAO3t9.jpg,1,2,Cardigan,0.451038,True
890240255349198849,2017-07-26 15:59:51,Twitter for iPhone,This is Cassie. She is a college pup. Studying international doggo communication and stick theory. 14/10 so elegant much sophisticate,https://twitter.com/dog_rates/status/890240255349198849/photo/1,14.0,Cassie,07-26-2017,2,doggo,6966,30795,https://pbs.twimg.com/media/DFrEyVuW0AAO3t9.jpg,1,3,Chihuahua,0.0292482,True
890006608113172480,2017-07-26 00:31:25,Twitter for iPhone,This is Koda. He is a South Australian deckshark. Deceptively deadly. Frighteningly majestic. 13/10 would risk a petting #BarkWeek,"https://twitter.com/dog_rates/status/890006608113172480/photo/1,https://twitter.com/dog_rates/status/890006608113172480/photo/1",13.0,Koda,07-26-2017,2,unknown,6932,29616,https://pbs.twimg.com/media/DFnwSY4WAAAMliS.jpg,1,1,Samoyed,0.957979,True
890006608113172480,2017-07-26 00:31:25,Twitter for iPhone,This is Koda. He is a South Australian deckshark. Deceptively deadly. Frighteningly majestic. 13/10 would risk a petting #BarkWeek,"https://twitter.com/dog_rates/status/890006608113172480/photo/1,https://twitter.com/dog_rates/status/890006608113172480/photo/1",13.0,Koda,07-26-2017,2,unknown,6932,29616,https://pbs.twimg.com/media/DFnwSY4WAAAMliS.jpg,1,2,Pomeranian,0.0138835,True
890006608113172480,2017-07-26 00:31:25,Twitter for iPhone,This is Koda. He is a South Australian deckshark. Deceptively deadly. Frighteningly majestic. 13/10 would risk a petting #BarkWeek,"https://twitter.com/dog_rates/status/890006608113172480/photo/1,https://twitter.com/dog_rates/status/890006608113172480/photo/1",13.0,Koda,07-26-2017,2,unknown,6932,29616,https://pbs.twimg.com/media/DFnwSY4WAAAMliS.jpg,1,3,Chow,0.00816748,True
889880896479866881,2017-07-25 16:11:53,Twitter for iPhone,This is Bruno. He is a service shark. Only gets out of the water to assist you. 13/10 terrifyingly good boy,https://twitter.com/dog_rates/status/889880896479866881/photo/1,13.0,Bruno,07-25-2017,1,unknown,4715,26860,https://pbs.twimg.com/media/DFl99B1WsAITKsg.jpg,1,1,French Bulldog,0.377417,True
889880896479866881,2017-07-25 16:11:53,Twitter for iPhone,This is Bruno. He is a service shark. Only gets out of the water to assist you. 13/10 terrifyingly good boy,https://twitter.com/dog_rates/status/889880896479866881/photo/1,13.0,Bruno,07-25-2017,1,unknown,4715,26860,https://pbs.twimg.com/media/DFl99B1WsAITKsg.jpg,1,2,Labrador Retriever,0.151317,True
889880896479866881,2017-07-25 16:11:53,Twitter for iPhone,This is Bruno. He is a service shark. Only gets out of the water to assist you. 13/10 terrifyingly good boy,https://twitter.com/dog_rates/status/889880896479866881/photo/1,13.0,Bruno,07-25-2017,1,unknown,4715,26860,https://pbs.twimg.com/media/DFl99B1WsAITKsg.jpg,1,3,Muzzle,0.0829811,False
889665388333682689,2017-07-25 01:55:32,Twitter for iPhone,Here's a puppo that seems to be on the fence about something haha no but seriously someone help her. 13/10,https://twitter.com/dog_rates/status/889665388333682689/photo/1,13.0,dog doe,07-25-2017,1,puppo,9489,46408,https://pbs.twimg.com/media/DFi579UWsAAatzw.jpg,1,1,Pembroke,0.966327,True
889665388333682689,2017-07-25 01:55:32,Twitter for iPhone,Here's a puppo that seems to be on the fence about something haha no but seriously someone help her. 13/10,https://twitter.com/dog_rates/status/889665388333682689/photo/1,13.0,dog doe,07-25-2017,1,puppo,9489,46408,https://pbs.twimg.com/media/DFi579UWsAAatzw.jpg,1,2,Cardigan,0.0273557,True
889665388333682689,2017-07-25 01:55:32,Twitter for iPhone,Here's a puppo that seems to be on the fence about something haha no but seriously someone help her. 13/10,https://twitter.com/dog_rates/status/889665388333682689/photo/1,13.0,dog doe,07-25-2017,1,puppo,9489,46408,https://pbs.twimg.com/media/DFi579UWsAAatzw.jpg,1,3,Basenji,0.00463323,True
889638837579907072,2017-07-25 00:10:02,Twitter for iPhone,This is Ted. He does his best. Sometimes that's not enough. But it's ok. 12/10 would assist,"https://twitter.com/dog_rates/status/889638837579907072/photo/1,https://twitter.com/dog_rates/status/889638837579907072/photo/1",12.0,Ted,07-25-2017,1,unknown,4257,26150,https://pbs.twimg.com/media/DFihzFfXsAYGDPR.jpg,1,1,French Bulldog,0.99165,True
889638837579907072,2017-07-25 00:10:02,Twitter for iPhone,This is Ted. He does his best. Sometimes that's not enough. But it's ok. 12/10 would assist,"https://twitter.com/dog_rates/status/889638837579907072/photo/1,https://twitter.com/dog_rates/status/889638837579907072/photo/1",12.0,Ted,07-25-2017,1,unknown,4257,26150,https://pbs.twimg.com/media/DFihzFfXsAYGDPR.jpg,1,2,Boxer,0.00212864,True
889638837579907072,2017-07-25 00:10:02,Twitter for iPhone,This is Ted. He does his best. Sometimes that's not enough. But it's ok. 12/10 would assist,"https://twitter.com/dog_rates/status/889638837579907072/photo/1,https://twitter.com/dog_rates/status/889638837579907072/photo/1",12.0,Ted,07-25-2017,1,unknown,4257,26150,https://pbs.twimg.com/media/DFihzFfXsAYGDPR.jpg,1,3,Staffordshire Bullterrier,0.00149818,True
889531135344209921,2017-07-24 17:02:04,Twitter for iPhone,This is Stuart. He's sporting his favorite fanny pack. Secretly filled with bones only. 13/10 puppared puppo #BarkWeek,https://twitter.com/dog_rates/status/889531135344209921/photo/1,13.0,Stuart,07-24-2017,0,puppo,2133,14599,https://pbs.twimg.com/media/DFg_2PVW0AEHN3p.jpg,1,1,Golden Retriever,0.953442,True
889531135344209921,2017-07-24 17:02:04,Twitter for iPhone,This is Stuart. He's sporting his favorite fanny pack. Secretly filled with bones only. 13/10 puppared puppo #BarkWeek,https://twitter.com/dog_rates/status/889531135344209921/photo/1,13.0,Stuart,07-24-2017,0,puppo,2133,14599,https://pbs.twimg.com/media/DFg_2PVW0AEHN3p.jpg,1,2,Labrador Retriever,0.0138341,True
889531135344209921,2017-07-24 17:02:04,Twitter for iPhone,This is Stuart. He's sporting his favorite fanny pack. Secretly filled with bones only. 13/10 puppared puppo #BarkWeek,https://twitter.com/dog_rates/status/889531135344209921/photo/1,13.0,Stuart,07-24-2017,0,puppo,2133,14599,https://pbs.twimg.com/media/DFg_2PVW0AEHN3p.jpg,1,3,Redbone,0.00795775,True
889278841981685760,2017-07-24 00:19:32,Twitter for iPhone,This is Oliver. You're witnessing one of his many brutal attacks. Seems to be playing with his victim. 13/10 fr*ckin frightening #BarkWeek,https://twitter.com/dog_rates/status/889278841981685760/video/1,13.0,Oliver,07-24-2017,0,unknown,5071,24349,https://pbs.twimg.com/ext_tw_video_thumb/889278779352338437/pu/img/VlbFB3v8H8VwzVNY.jpg,1,1,Whippet,0.626152,True
889278841981685760,2017-07-24 00:19:32,Twitter for iPhone,This is Oliver. You're witnessing one of his many brutal attacks. Seems to be playing with his victim. 13/10 fr*ckin frightening #BarkWeek,https://twitter.com/dog_rates/status/889278841981685760/video/1,13.0,Oliver,07-24-2017,0,unknown,5071,24349,https://pbs.twimg.com/ext_tw_video_thumb/889278779352338437/pu/img/VlbFB3v8H8VwzVNY.jpg,1,2,Borzoi,0.194742,True
889278841981685760,2017-07-24 00:19:32,Twitter for iPhone,This is Oliver. You're witnessing one of his many brutal attacks. Seems to be playing with his victim. 13/10 fr*ckin frightening #BarkWeek,https://twitter.com/dog_rates/status/889278841981685760/video/1,13.0,Oliver,07-24-2017,0,unknown,5071,24349,https://pbs.twimg.com/ext_tw_video_thumb/889278779352338437/pu/img/VlbFB3v8H8VwzVNY.jpg,1,3,Saluki,0.0273507,True
888917238123831296,2017-07-23 00:22:39,Twitter for iPhone,This is Jim. He found a fren. Taught him how to sit like the good boys. 12/10 for both,https://twitter.com/dog_rates/status/888917238123831296/photo/1,12.0,Jim,07-23-2017,6,unknown,4251,28117,https://pbs.twimg.com/media/DFYRgsOUQAARGhO.jpg,1,1,Golden Retriever,0.714719,True
888917238123831296,2017-07-23 00:22:39,Twitter for iPhone,This is Jim. He found a fren. Taught him how to sit like the good boys. 12/10 for both,https://twitter.com/dog_rates/status/888917238123831296/photo/1,12.0,Jim,07-23-2017,6,unknown,4251,28117,https://pbs.twimg.com/media/DFYRgsOUQAARGhO.jpg,1,2,Tibetan Mastiff,0.120184,True
888917238123831296,2017-07-23 00:22:39,Twitter for iPhone,This is Jim. He found a fren. Taught him how to sit like the good boys. 12/10 for both,https://twitter.com/dog_rates/status/888917238123831296/photo/1,12.0,Jim,07-23-2017,6,unknown,4251,28117,https://pbs.twimg.com/media/DFYRgsOUQAARGhO.jpg,1,3,Labrador Retriever,0.105506,True
888804989199671297,2017-07-22 16:56:37,Twitter for iPhone,This is Zeke. He has a new stick. Very proud of it. Would like you to throw it for him without taking it. 13/10 would do my best,"https://twitter.com/dog_rates/status/888804989199671297/photo/1,https://twitter.com/dog_rates/status/888804989199671297/photo/1",13.0,Zeke,07-22-2017,5,unknown,4031,24679,https://pbs.twimg.com/media/DFWra-3VYAA2piG.jpg,1,1,Golden Retriever,0.46976,True
888804989199671297,2017-07-22 16:56:37,Twitter for iPhone,This is Zeke. He has a new stick. Very proud of it. Would like you to throw it for him without taking it. 13/10 would do my best,"https://twitter.com/dog_rates/status/888804989199671297/photo/1,https://twitter.com/dog_rates/status/888804989199671297/photo/1",13.0,Zeke,07-22-2017,5,unknown,4031,24679,https://pbs.twimg.com/media/DFWra-3VYAA2piG.jpg,1,2,Labrador Retriever,0.184172,True
888804989199671297,2017-07-22 16:56:37,Twitter for iPhone,This is Zeke. He has a new stick. Very proud of it. Would like you to throw it for him without taking it. 13/10 would do my best,"https://twitter.com/dog_rates/status/888804989199671297/photo/1,https://twitter.com/dog_rates/status/888804989199671297/photo/1",13.0,Zeke,07-22-2017,5,unknown,4031,24679,https://pbs.twimg.com/media/DFWra-3VYAA2piG.jpg,1,3,English Setter,0.0734817,True
888554962724278272,2017-07-22 00:23:06,Twitter for iPhone,This is Ralphus. He's powering up. Attempting maximum borkdrive. 13/10 inspirational af,"https://twitter.com/dog_rates/status/888554962724278272/photo/1,https://twitter.com/dog_rates/status/888554962724278272/photo/1,https://twitter.com/dog_rates/status/888554962724278272/photo/1,https://twitter.com/dog_rates/status/888554962724278272/photo/1",13.0,Ralphus,07-22-2017,5,unknown,3331,19114,https://pbs.twimg.com/media/DFTH_O-UQAACu20.jpg,3,1,Siberian Husky,0.700377,True
888554962724278272,2017-07-22 00:23:06,Twitter for iPhone,This is Ralphus. He's powering up. Attempting maximum borkdrive. 13/10 inspirational af,"https://twitter.com/dog_rates/status/888554962724278272/photo/1,https://twitter.com/dog_rates/status/888554962724278272/photo/1,https://twitter.com/dog_rates/status/888554962724278272/photo/1,https://twitter.com/dog_rates/status/888554962724278272/photo/1",13.0,Ralphus,07-22-2017,5,unknown,3331,19114,https://pbs.twimg.com/media/DFTH_O-UQAACu20.jpg,3,2,Eskimo Dog,0.166511,True
888554962724278272,2017-07-22 00:23:06,Twitter for iPhone,This is Ralphus. He's powering up. Attempting maximum borkdrive. 13/10 inspirational af,"https://twitter.com/dog_rates/status/888554962724278272/photo/1,https://twitter.com/dog_rates/status/888554962724278272/photo/1,https://twitter.com/dog_rates/status/888554962724278272/photo/1,https://twitter.com/dog_rates/status/888554962724278272/photo/1",13.0,Ralphus,07-22-2017,5,unknown,3331,19114,https://pbs.twimg.com/media/DFTH_O-UQAACu20.jpg,3,3,Malamute,0.111411,True
888078434458587136,2017-07-20 16:49:33,Twitter for iPhone,This is Gerald. He was just told he didn't get the job he interviewed for. A h*ckin injustice. 12/10 didn't want the job anyway,"https://twitter.com/dog_rates/status/888078434458587136/photo/1,https://twitter.com/dog_rates/status/888078434458587136/photo/1",12.0,Gerald,07-20-2017,3,unknown,3284,21000,https://pbs.twimg.com/media/DFMWn56WsAAkA7B.jpg,1,1,French Bulldog,0.995026,True
888078434458587136,2017-07-20 16:49:33,Twitter for iPhone,This is Gerald. He was just told he didn't get the job he interviewed for. A h*ckin injustice. 12/10 didn't want the job anyway,"https://twitter.com/dog_rates/status/888078434458587136/photo/1,https://twitter.com/dog_rates/status/888078434458587136/photo/1",12.0,Gerald,07-20-2017,3,unknown,3284,21000,https://pbs.twimg.com/media/DFMWn56WsAAkA7B.jpg,1,2,Pug,0.000931908,True
888078434458587136,2017-07-20 16:49:33,Twitter for iPhone,This is Gerald. He was just told he didn't get the job he interviewed for. A h*ckin injustice. 12/10 didn't want the job anyway,"https://twitter.com/dog_rates/status/888078434458587136/photo/1,https://twitter.com/dog_rates/status/888078434458587136/photo/1",12.0,Gerald,07-20-2017,3,unknown,3284,21000,https://pbs.twimg.com/media/DFMWn56WsAAkA7B.jpg,1,3,Bull Mastiff,0.000903211,True
887705289381826560,2017-07-19 16:06:48,Twitter for iPhone,This is Jeffrey. He has a monopoly on the pool noodles. Currently running a 'boop for two' midweek sale. 13/10 h*ckin strategic,https://twitter.com/dog_rates/status/887705289381826560/photo/1,13.0,Jeffrey,07-19-2017,2,unknown,5092,29131,https://pbs.twimg.com/media/DFHDQBbXgAEqY7t.jpg,1,1,Basset,0.821664,True
887705289381826560,2017-07-19 16:06:48,Twitter for iPhone,This is Jeffrey. He has a monopoly on the pool noodles. Currently running a 'boop for two' midweek sale. 13/10 h*ckin strategic,https://twitter.com/dog_rates/status/887705289381826560/photo/1,13.0,Jeffrey,07-19-2017,2,unknown,5092,29131,https://pbs.twimg.com/media/DFHDQBbXgAEqY7t.jpg,1,2,Redbone,0.0875815,True
887705289381826560,2017-07-19 16:06:48,Twitter for iPhone,This is Jeffrey. He has a monopoly on the pool noodles. Currently running a 'boop for two' midweek sale. 13/10 h*ckin strategic,https://twitter.com/dog_rates/status/887705289381826560/photo/1,13.0,Jeffrey,07-19-2017,2,unknown,5092,29131,https://pbs.twimg.com/media/DFHDQBbXgAEqY7t.jpg,1,3,Weimaraner,0.026236400000000003,True
887517139158093824,2017-07-19 03:39:09,Twitter for iPhone,I've yet to rate a Venezuelan Hover Wiener. This is such an honor. 14/10 paw-inspiring af (IG: roxy.thedoxy),https://twitter.com/dog_rates/status/887517139158093824/video/1,14.0,dog doe,07-19-2017,2,unknown,11085,44690,https://pbs.twimg.com/ext_tw_video_thumb/887517108413886465/pu/img/WanJKwssZj4VJvL9.jpg,1,1,Limousine,0.130432,False
887517139158093824,2017-07-19 03:39:09,Twitter for iPhone,I've yet to rate a Venezuelan Hover Wiener. This is such an honor. 14/10 paw-inspiring af (IG: roxy.thedoxy),https://twitter.com/dog_rates/status/887517139158093824/video/1,14.0,dog doe,07-19-2017,2,unknown,11085,44690,https://pbs.twimg.com/ext_tw_video_thumb/887517108413886465/pu/img/WanJKwssZj4VJvL9.jpg,1,2,Tow Truck,0.0291754,False
887517139158093824,2017-07-19 03:39:09,Twitter for iPhone,I've yet to rate a Venezuelan Hover Wiener. This is such an honor. 14/10 paw-inspiring af (IG: roxy.thedoxy),https://twitter.com/dog_rates/status/887517139158093824/video/1,14.0,dog doe,07-19-2017,2,unknown,11085,44690,https://pbs.twimg.com/ext_tw_video_thumb/887517108413886465/pu/img/WanJKwssZj4VJvL9.jpg,1,3,Shopping Cart,0.0263208,False
887473957103951883,2017-07-19 00:47:34,Twitter for iPhone,This is Canela. She attempted some fancy porch pics. They were unsuccessful. 13/10 someone help her,"https://twitter.com/dog_rates/status/887473957103951883/photo/1,https://twitter.com/dog_rates/status/887473957103951883/photo/1",13.0,Canela,07-19-2017,2,unknown,17073,66446,https://pbs.twimg.com/media/DFDw2tyUQAAAFke.jpg,2,1,Pembroke,0.809197,True
887473957103951883,2017-07-19 00:47:34,Twitter for iPhone,This is Canela. She attempted some fancy porch pics. They were unsuccessful. 13/10 someone help her,"https://twitter.com/dog_rates/status/887473957103951883/photo/1,https://twitter.com/dog_rates/status/887473957103951883/photo/1",13.0,Canela,07-19-2017,2,unknown,17073,66446,https://pbs.twimg.com/media/DFDw2tyUQAAAFke.jpg,2,2,Rhodesian Ridgeback,0.05495,True
887473957103951883,2017-07-19 00:47:34,Twitter for iPhone,This is Canela. She attempted some fancy porch pics. They were unsuccessful. 13/10 someone help her,"https://twitter.com/dog_rates/status/887473957103951883/photo/1,https://twitter.com/dog_rates/status/887473957103951883/photo/1",13.0,Canela,07-19-2017,2,unknown,17073,66446,https://pbs.twimg.com/media/DFDw2tyUQAAAFke.jpg,2,3,Beagle,0.0389148,True
887343217045368832,2017-07-18 16:08:03,Twitter for iPhone,You may not have known you needed to see this today. 13/10 please enjoy (IG: emmylouroo),https://twitter.com/dog_rates/status/887343217045368832/video/1,13.0,dog doe,07-18-2017,1,unknown,9869,32477,https://pbs.twimg.com/ext_tw_video_thumb/887343120832229379/pu/img/6HSuFrW1lzI_9Mht.jpg,1,1,Mexican Hairless,0.330741,True
887343217045368832,2017-07-18 16:08:03,Twitter for iPhone,You may not have known you needed to see this today. 13/10 please enjoy (IG: emmylouroo),https://twitter.com/dog_rates/status/887343217045368832/video/1,13.0,dog doe,07-18-2017,1,unknown,9869,32477,https://pbs.twimg.com/ext_tw_video_thumb/887343120832229379/pu/img/6HSuFrW1lzI_9Mht.jpg,1,2,Sea Lion,0.275645,False
887343217045368832,2017-07-18 16:08:03,Twitter for iPhone,You may not have known you needed to see this today. 13/10 please enjoy (IG: emmylouroo),https://twitter.com/dog_rates/status/887343217045368832/video/1,13.0,dog doe,07-18-2017,1,unknown,9869,32477,https://pbs.twimg.com/ext_tw_video_thumb/887343120832229379/pu/img/6HSuFrW1lzI_9Mht.jpg,1,3,Weimaraner,0.134203,True
887101392804085760,2017-07-18 00:07:08,Twitter for iPhone,This... is a Jubilant Antarctic House Bear. We only rate dogs. Please only send dogs. Thank you... 12/10 would suffocate in floof,https://twitter.com/dog_rates/status/887101392804085760/photo/1,12.0,dog doe,07-18-2017,1,unknown,5640,29505,https://pbs.twimg.com/media/DE-eAq6UwAA-jaE.jpg,1,1,Samoyed,0.733942,True
887101392804085760,2017-07-18 00:07:08,Twitter for iPhone,This... is a Jubilant Antarctic House Bear. We only rate dogs. Please only send dogs. Thank you... 12/10 would suffocate in floof,https://twitter.com/dog_rates/status/887101392804085760/photo/1,12.0,dog doe,07-18-2017,1,unknown,5640,29505,https://pbs.twimg.com/media/DE-eAq6UwAA-jaE.jpg,1,2,Eskimo Dog,0.0350295,True
887101392804085760,2017-07-18 00:07:08,Twitter for iPhone,This... is a Jubilant Antarctic House Bear. We only rate dogs. Please only send dogs. Thank you... 12/10 would suffocate in floof,https://twitter.com/dog_rates/status/887101392804085760/photo/1,12.0,dog doe,07-18-2017,1,unknown,5640,29505,https://pbs.twimg.com/media/DE-eAq6UwAA-jaE.jpg,1,3,Staffordshire Bullterrier,0.029704700000000007,True
886983233522544640,2017-07-17 16:17:36,Twitter for iPhone,This is Maya. She's very shy. Rarely leaves her cup. 13/10 would find her an environment to thrive in,"https://twitter.com/dog_rates/status/886983233522544640/photo/1,https://twitter.com/dog_rates/status/886983233522544640/photo/1",13.0,Maya,07-17-2017,0,unknown,7272,33859,https://pbs.twimg.com/media/DE8yicJW0AAAvBJ.jpg,2,1,Chihuahua,0.793469,True
886983233522544640,2017-07-17 16:17:36,Twitter for iPhone,This is Maya. She's very shy. Rarely leaves her cup. 13/10 would find her an environment to thrive in,"https://twitter.com/dog_rates/status/886983233522544640/photo/1,https://twitter.com/dog_rates/status/886983233522544640/photo/1",13.0,Maya,07-17-2017,0,unknown,7272,33859,https://pbs.twimg.com/media/DE8yicJW0AAAvBJ.jpg,2,2,Toy Terrier,0.143528,True
886983233522544640,2017-07-17 16:17:36,Twitter for iPhone,This is Maya. She's very shy. Rarely leaves her cup. 13/10 would find her an environment to thrive in,"https://twitter.com/dog_rates/status/886983233522544640/photo/1,https://twitter.com/dog_rates/status/886983233522544640/photo/1",13.0,Maya,07-17-2017,0,unknown,7272,33859,https://pbs.twimg.com/media/DE8yicJW0AAAvBJ.jpg,2,3,Can Opener,0.0322529,False
886736880519319552,2017-07-16 23:58:41,Twitter for iPhone,"This is Mingus. He's a wonderful father to his smol pup. Confirmed 13/10, but he needs your help
","https://www.gofundme.com/mingusneedsus,https://twitter.com/dog_rates/status/886736880519319552/photo/1,https://twitter.com/dog_rates/status/886736880519319552/photo/1",13.0,Mingus,07-16-2017,6,unknown,3066,11595,https://pbs.twimg.com/media/DE5Se8FXcAAJFx4.jpg,1,1,Kuvasz,0.309706,True
886736880519319552,2017-07-16 23:58:41,Twitter for iPhone,"This is Mingus. He's a wonderful father to his smol pup. Confirmed 13/10, but he needs your help
","https://www.gofundme.com/mingusneedsus,https://twitter.com/dog_rates/status/886736880519319552/photo/1,https://twitter.com/dog_rates/status/886736880519319552/photo/1",13.0,Mingus,07-16-2017,6,unknown,3066,11595,https://pbs.twimg.com/media/DE5Se8FXcAAJFx4.jpg,1,2,Great Pyrenees,0.186136,True
886736880519319552,2017-07-16 23:58:41,Twitter for iPhone,"This is Mingus. He's a wonderful father to his smol pup. Confirmed 13/10, but he needs your help
","https://www.gofundme.com/mingusneedsus,https://twitter.com/dog_rates/status/886736880519319552/photo/1,https://twitter.com/dog_rates/status/886736880519319552/photo/1",13.0,Mingus,07-16-2017,6,unknown,3066,11595,https://pbs.twimg.com/media/DE5Se8FXcAAJFx4.jpg,1,3,Dandie Dinmont,0.08634630000000001,True
886680336477933568,2017-07-16 20:14:00,Twitter for iPhone,This is Derek. He's late for a dog meeting. 13/10 pet...al to the metal,https://twitter.com/dog_rates/status/886680336477933568/photo/1,13.0,Derek,07-16-2017,6,unknown,4209,21646,https://pbs.twimg.com/media/DE4fEDzWAAAyHMM.jpg,1,1,Convertible,0.738995,False
886680336477933568,2017-07-16 20:14:00,Twitter for iPhone,This is Derek. He's late for a dog meeting. 13/10 pet...al to the metal,https://twitter.com/dog_rates/status/886680336477933568/photo/1,13.0,Derek,07-16-2017,6,unknown,4209,21646,https://pbs.twimg.com/media/DE4fEDzWAAAyHMM.jpg,1,2,Sports Car,0.139952,False
886680336477933568,2017-07-16 20:14:00,Twitter for iPhone,This is Derek. He's late for a dog meeting. 13/10 pet...al to the metal,https://twitter.com/dog_rates/status/886680336477933568/photo/1,13.0,Derek,07-16-2017,6,unknown,4209,21646,https://pbs.twimg.com/media/DE4fEDzWAAAyHMM.jpg,1,3,Car Wheel,0.0441727,False
886366144734445568,2017-07-15 23:25:31,Twitter for iPhone,This is Roscoe. Another pupper fallen victim to spontaneous tongue ejections. Get the BlepiPen immediate. 12/10 deep breaths Roscoe,"https://twitter.com/dog_rates/status/886366144734445568/photo/1,https://twitter.com/dog_rates/status/886366144734445568/photo/1",12.0,Roscoe,07-15-2017,5,pupper,3015,20424,https://pbs.twimg.com/media/DE0BTnQUwAApKEH.jpg,1,1,French Bulldog,0.999201,True
886366144734445568,2017-07-15 23:25:31,Twitter for iPhone,This is Roscoe. Another pupper fallen victim to spontaneous tongue ejections. Get the BlepiPen immediate. 12/10 deep breaths Roscoe,"https://twitter.com/dog_rates/status/886366144734445568/photo/1,https://twitter.com/dog_rates/status/886366144734445568/photo/1",12.0,Roscoe,07-15-2017,5,pupper,3015,20424,https://pbs.twimg.com/media/DE0BTnQUwAApKEH.jpg,1,2,Chihuahua,0.000361178,True
886366144734445568,2017-07-15 23:25:31,Twitter for iPhone,This is Roscoe. Another pupper fallen victim to spontaneous tongue ejections. Get the BlepiPen immediate. 12/10 deep breaths Roscoe,"https://twitter.com/dog_rates/status/886366144734445568/photo/1,https://twitter.com/dog_rates/status/886366144734445568/photo/1",12.0,Roscoe,07-15-2017,5,pupper,3015,20424,https://pbs.twimg.com/media/DE0BTnQUwAApKEH.jpg,1,3,Boston Bull,7.55616e-05,True
886258384151887873,2017-07-15 16:17:19,Twitter for iPhone,This is Waffles. His doggles are pupside down. Unsure how to fix. 13/10 someone assist Waffles,https://twitter.com/dog_rates/status/886258384151887873/photo/1,13.0,Waffles,07-15-2017,5,unknown,5964,27000,https://pbs.twimg.com/media/DEyfTG4UMAE4aE9.jpg,1,1,Pug,0.943575,True
886258384151887873,2017-07-15 16:17:19,Twitter for iPhone,This is Waffles. His doggles are pupside down. Unsure how to fix. 13/10 someone assist Waffles,https://twitter.com/dog_rates/status/886258384151887873/photo/1,13.0,Waffles,07-15-2017,5,unknown,5964,27000,https://pbs.twimg.com/media/DEyfTG4UMAE4aE9.jpg,1,2,Shower Cap,0.0252856,False
886258384151887873,2017-07-15 16:17:19,Twitter for iPhone,This is Waffles. His doggles are pupside down. Unsure how to fix. 13/10 someone assist Waffles,https://twitter.com/dog_rates/status/886258384151887873/photo/1,13.0,Waffles,07-15-2017,5,unknown,5964,27000,https://pbs.twimg.com/media/DEyfTG4UMAE4aE9.jpg,1,3,Siamese Cat,0.00284892,False
885984800019947520,2017-07-14 22:10:11,Twitter for iPhone,Viewer discretion advised. This is Jimbo. He will rip ur finger right h*ckin off. Other dog clearly an accessory. 12/10 pls pet with caution,https://twitter.com/dog_rates/status/885984800019947520/photo/1,12.0,Jimbo,07-14-2017,4,unknown,6393,31462,https://pbs.twimg.com/media/DEumeWWV0AA-Z61.jpg,1,1,Blenheim Spaniel,0.972494,True
885984800019947520,2017-07-14 22:10:11,Twitter for iPhone,Viewer discretion advised. This is Jimbo. He will rip ur finger right h*ckin off. Other dog clearly an accessory. 12/10 pls pet with caution,https://twitter.com/dog_rates/status/885984800019947520/photo/1,12.0,Jimbo,07-14-2017,4,unknown,6393,31462,https://pbs.twimg.com/media/DEumeWWV0AA-Z61.jpg,1,2,Shih Tzu,0.00663012,True
885984800019947520,2017-07-14 22:10:11,Twitter for iPhone,Viewer discretion advised. This is Jimbo. He will rip ur finger right h*ckin off. Other dog clearly an accessory. 12/10 pls pet with caution,https://twitter.com/dog_rates/status/885984800019947520/photo/1,12.0,Jimbo,07-14-2017,4,unknown,6393,31462,https://pbs.twimg.com/media/DEumeWWV0AA-Z61.jpg,1,3,Bernese Mountain Dog,0.00623915,True
885528943205470208,2017-07-13 15:58:47,Twitter for iPhone,This is Maisey. She fell asleep mid-excavation. Happens to the best of us. 13/10 would pat noggin approvingly,https://twitter.com/dog_rates/status/885528943205470208/photo/1,13.0,Maisey,07-13-2017,3,unknown,6070,34711,https://pbs.twimg.com/media/DEoH3yvXgAAzQtS.jpg,1,1,Pug,0.369275,True
885528943205470208,2017-07-13 15:58:47,Twitter for iPhone,This is Maisey. She fell asleep mid-excavation. Happens to the best of us. 13/10 would pat noggin approvingly,https://twitter.com/dog_rates/status/885528943205470208/photo/1,13.0,Maisey,07-13-2017,3,unknown,6070,34711,https://pbs.twimg.com/media/DEoH3yvXgAAzQtS.jpg,1,2,Labrador Retriever,0.265835,True
885528943205470208,2017-07-13 15:58:47,Twitter for iPhone,This is Maisey. She fell asleep mid-excavation. Happens to the best of us. 13/10 would pat noggin approvingly,https://twitter.com/dog_rates/status/885528943205470208/photo/1,13.0,Maisey,07-13-2017,3,unknown,6070,34711,https://pbs.twimg.com/media/DEoH3yvXgAAzQtS.jpg,1,3,Kuvasz,0.134697,True
885167619883638784,2017-07-12 16:03:00,Twitter for iPhone,Here we have a corgi undercover as a malamute. Pawbably doing important investigative work. Zero control over tongue happenings. 13/10,"https://twitter.com/dog_rates/status/885167619883638784/photo/1,https://twitter.com/dog_rates/status/885167619883638784/photo/1,https://twitter.com/dog_rates/status/885167619883638784/photo/1,https://twitter.com/dog_rates/status/885167619883638784/photo/1",13.0,dog doe,07-12-2017,2,unknown,4138,21148,https://pbs.twimg.com/media/DEi_N9qXYAAgEEw.jpg,4,1,Malamute,0.8124819999999999,True
885167619883638784,2017-07-12 16:03:00,Twitter for iPhone,Here we have a corgi undercover as a malamute. Pawbably doing important investigative work. Zero control over tongue happenings. 13/10,"https://twitter.com/dog_rates/status/885167619883638784/photo/1,https://twitter.com/dog_rates/status/885167619883638784/photo/1,https://twitter.com/dog_rates/status/885167619883638784/photo/1,https://twitter.com/dog_rates/status/885167619883638784/photo/1",13.0,dog doe,07-12-2017,2,unknown,4138,21148,https://pbs.twimg.com/media/DEi_N9qXYAAgEEw.jpg,4,2,Siberian Husky,0.0717125,True
885167619883638784,2017-07-12 16:03:00,Twitter for iPhone,Here we have a corgi undercover as a malamute. Pawbably doing important investigative work. Zero control over tongue happenings. 13/10,"https://twitter.com/dog_rates/status/885167619883638784/photo/1,https://twitter.com/dog_rates/status/885167619883638784/photo/1,https://twitter.com/dog_rates/status/885167619883638784/photo/1,https://twitter.com/dog_rates/status/885167619883638784/photo/1",13.0,dog doe,07-12-2017,2,unknown,4138,21148,https://pbs.twimg.com/media/DEi_N9qXYAAgEEw.jpg,4,3,Eskimo Dog,0.0557697,True
884925521741709313,2017-07-12 00:01:00,Twitter for iPhone,"This is Earl. He found a hat. Nervous about what you think of it. 12/10 it's delightful, Earl",https://twitter.com/dog_rates/status/884925521741709313/photo/1,12.0,Earl,07-12-2017,2,unknown,17165,74624,https://pbs.twimg.com/media/DEfjEaNXkAAtPlj.jpg,1,1,Italian Greyhound,0.259916,True
884925521741709313,2017-07-12 00:01:00,Twitter for iPhone,"This is Earl. He found a hat. Nervous about what you think of it. 12/10 it's delightful, Earl",https://twitter.com/dog_rates/status/884925521741709313/photo/1,12.0,Earl,07-12-2017,2,unknown,17165,74624,https://pbs.twimg.com/media/DEfjEaNXkAAtPlj.jpg,1,2,American Staffordshire Terrier,0.198451,True
884925521741709313,2017-07-12 00:01:00,Twitter for iPhone,"This is Earl. He found a hat. Nervous about what you think of it. 12/10 it's delightful, Earl",https://twitter.com/dog_rates/status/884925521741709313/photo/1,12.0,Earl,07-12-2017,2,unknown,17165,74624,https://pbs.twimg.com/media/DEfjEaNXkAAtPlj.jpg,1,3,Staffordshire Bullterrier,0.127725,True
884876753390489601,2017-07-11 20:47:12,Twitter for iPhone,This is Lola. It's her first time outside. Must test the earth and taste the atmosphere. 13/10 you're doing great Lola,"https://twitter.com/dog_rates/status/884876753390489601/photo/1,https://twitter.com/dog_rates/status/884876753390489601/photo/1,https://twitter.com/dog_rates/status/884876753390489601/photo/1,https://twitter.com/dog_rates/status/884876753390489601/photo/1",13.0,Lola,07-11-2017,1,unknown,5297,26915,https://pbs.twimg.com/media/DEe2tZXXkAAwyX3.jpg,1,1,Chow,0.822103,True
884876753390489601,2017-07-11 20:47:12,Twitter for iPhone,This is Lola. It's her first time outside. Must test the earth and taste the atmosphere. 13/10 you're doing great Lola,"https://twitter.com/dog_rates/status/884876753390489601/photo/1,https://twitter.com/dog_rates/status/884876753390489601/photo/1,https://twitter.com/dog_rates/status/884876753390489601/photo/1,https://twitter.com/dog_rates/status/884876753390489601/photo/1",13.0,Lola,07-11-2017,1,unknown,5297,26915,https://pbs.twimg.com/media/DEe2tZXXkAAwyX3.jpg,1,2,Norwich Terrier,0.106075,True
884876753390489601,2017-07-11 20:47:12,Twitter for iPhone,This is Lola. It's her first time outside. Must test the earth and taste the atmosphere. 13/10 you're doing great Lola,"https://twitter.com/dog_rates/status/884876753390489601/photo/1,https://twitter.com/dog_rates/status/884876753390489601/photo/1,https://twitter.com/dog_rates/status/884876753390489601/photo/1,https://twitter.com/dog_rates/status/884876753390489601/photo/1",13.0,Lola,07-11-2017,1,unknown,5297,26915,https://pbs.twimg.com/media/DEe2tZXXkAAwyX3.jpg,1,3,Norfolk Terrier,0.0373485,True
884562892145688576,2017-07-11 00:00:02,Twitter for iPhone,This is Kevin. He's just so happy. 13/10 what is your secret Kevin,https://twitter.com/dog_rates/status/884562892145688576/photo/1,13.0,Kevin,07-11-2017,1,unknown,4447,23436,https://pbs.twimg.com/media/DEaZQkfXUAEC7qB.jpg,1,1,Pug,0.5464060000000001,True
884562892145688576,2017-07-11 00:00:02,Twitter for iPhone,This is Kevin. He's just so happy. 13/10 what is your secret Kevin,https://twitter.com/dog_rates/status/884562892145688576/photo/1,13.0,Kevin,07-11-2017,1,unknown,4447,23436,https://pbs.twimg.com/media/DEaZQkfXUAEC7qB.jpg,1,2,French Bulldog,0.404291,True
884562892145688576,2017-07-11 00:00:02,Twitter for iPhone,This is Kevin. He's just so happy. 13/10 what is your secret Kevin,https://twitter.com/dog_rates/status/884562892145688576/photo/1,13.0,Kevin,07-11-2017,1,unknown,4447,23436,https://pbs.twimg.com/media/DEaZQkfXUAEC7qB.jpg,1,3,Brabancon Griffon,0.0440019,True
884441805382717440,2017-07-10 15:58:53,Twitter for iPhone,"I present to you, Pup in Hat. Pup in Hat is great for all occasions. Extremely versatile. Compact as h*ck. 14/10 (IG: itselizabethgales)",https://twitter.com/dog_rates/status/884441805382717440/photo/1,14.0,dog doe,07-10-2017,0,unknown,5378,26087,https://pbs.twimg.com/media/DEYrIZwWsAA2Wo5.jpg,1,1,Pembroke,0.993225,True
884441805382717440,2017-07-10 15:58:53,Twitter for iPhone,"I present to you, Pup in Hat. Pup in Hat is great for all occasions. Extremely versatile. Compact as h*ck. 14/10 (IG: itselizabethgales)",https://twitter.com/dog_rates/status/884441805382717440/photo/1,14.0,dog doe,07-10-2017,0,unknown,5378,26087,https://pbs.twimg.com/media/DEYrIZwWsAA2Wo5.jpg,1,2,Cardigan,0.00321648,True
884441805382717440,2017-07-10 15:58:53,Twitter for iPhone,"I present to you, Pup in Hat. Pup in Hat is great for all occasions. Extremely versatile. Compact as h*ck. 14/10 (IG: itselizabethgales)",https://twitter.com/dog_rates/status/884441805382717440/photo/1,14.0,dog doe,07-10-2017,0,unknown,5378,26087,https://pbs.twimg.com/media/DEYrIZwWsAA2Wo5.jpg,1,3,Chihuahua,0.00208089,True
884162670584377345,2017-07-09 21:29:42,Twitter for iPhone,Meet Yogi. He doesn't have any important dog meetings today he just enjoys looking his best at all times. 12/10 for dangerously dapper doggo,https://twitter.com/dog_rates/status/884162670584377345/photo/1,12.0,Yogi,07-09-2017,6,doggo,2824,19654,https://pbs.twimg.com/media/DEUtQbzW0AUTv_o.jpg,1,1,German Shepherd,0.707046,True
884162670584377345,2017-07-09 21:29:42,Twitter for iPhone,Meet Yogi. He doesn't have any important dog meetings today he just enjoys looking his best at all times. 12/10 for dangerously dapper doggo,https://twitter.com/dog_rates/status/884162670584377345/photo/1,12.0,Yogi,07-09-2017,6,doggo,2824,19654,https://pbs.twimg.com/media/DEUtQbzW0AUTv_o.jpg,1,2,Malinois,0.199396,True
884162670584377345,2017-07-09 21:29:42,Twitter for iPhone,Meet Yogi. He doesn't have any important dog meetings today he just enjoys looking his best at all times. 12/10 for dangerously dapper doggo,https://twitter.com/dog_rates/status/884162670584377345/photo/1,12.0,Yogi,07-09-2017,6,doggo,2824,19654,https://pbs.twimg.com/media/DEUtQbzW0AUTv_o.jpg,1,3,Norwegian Elkhound,0.0491476,True
883838122936631299,2017-07-09 00:00:04,Twitter for iPhone,This is Noah. He can't believe someone made this mess. Got the vacuum out for you though. Offered to help clean pup. 12/10 super good boy,https://twitter.com/dog_rates/status/883838122936631299/photo/1,12.0,Noah,07-09-2017,6,unknown,3267,21108,https://pbs.twimg.com/media/DEQGFgAXUAAEvfi.jpg,1,1,Doberman,0.610946,True
883838122936631299,2017-07-09 00:00:04,Twitter for iPhone,This is Noah. He can't believe someone made this mess. Got the vacuum out for you though. Offered to help clean pup. 12/10 super good boy,https://twitter.com/dog_rates/status/883838122936631299/photo/1,12.0,Noah,07-09-2017,6,unknown,3267,21108,https://pbs.twimg.com/media/DEQGFgAXUAAEvfi.jpg,1,2,Miniature Pinscher,0.299603,True
883838122936631299,2017-07-09 00:00:04,Twitter for iPhone,This is Noah. He can't believe someone made this mess. Got the vacuum out for you though. Offered to help clean pup. 12/10 super good boy,https://twitter.com/dog_rates/status/883838122936631299/photo/1,12.0,Noah,07-09-2017,6,unknown,3267,21108,https://pbs.twimg.com/media/DEQGFgAXUAAEvfi.jpg,1,3,Kelpie,0.0630203,True
883482846933004288,2017-07-08 00:28:19,Twitter for iPhone,"This is Bella. She hopes her smile made you smile. If not, she is also offering you her favorite monkey. 13.5/10","https://twitter.com/dog_rates/status/883482846933004288/photo/1,https://twitter.com/dog_rates/status/883482846933004288/photo/1",13.5,Bella,07-08-2017,5,unknown,9371,44305,https://pbs.twimg.com/media/DELC9dZXUAADqUk.jpg,1,1,Golden Retriever,0.943082,True
883482846933004288,2017-07-08 00:28:19,Twitter for iPhone,"This is Bella. She hopes her smile made you smile. If not, she is also offering you her favorite monkey. 13.5/10","https://twitter.com/dog_rates/status/883482846933004288/photo/1,https://twitter.com/dog_rates/status/883482846933004288/photo/1",13.5,Bella,07-08-2017,5,unknown,9371,44305,https://pbs.twimg.com/media/DELC9dZXUAADqUk.jpg,1,2,Labrador Retriever,0.032409,True
883482846933004288,2017-07-08 00:28:19,Twitter for iPhone,"This is Bella. She hopes her smile made you smile. If not, she is also offering you her favorite monkey. 13.5/10","https://twitter.com/dog_rates/status/883482846933004288/photo/1,https://twitter.com/dog_rates/status/883482846933004288/photo/1",13.5,Bella,07-08-2017,5,unknown,9371,44305,https://pbs.twimg.com/media/DELC9dZXUAADqUk.jpg,1,3,Kuvasz,0.00550072,True
883360690899218434,2017-07-07 16:22:55,Twitter for iPhone,Meet Grizzwald. He may be the floofiest floofer I ever did see. Lost eyes saving a schoolbus from a volcano erpuption. 13/10 heroic as h*ck,https://twitter.com/dog_rates/status/883360690899218434/photo/1,13.0,Grizzwald,07-07-2017,4,floofer,3509,21898,https://pbs.twimg.com/media/DEJT3FeXoAAtwUy.jpg,1,1,Chow,0.987997,True
883360690899218434,2017-07-07 16:22:55,Twitter for iPhone,Meet Grizzwald. He may be the floofiest floofer I ever did see. Lost eyes saving a schoolbus from a volcano erpuption. 13/10 heroic as h*ck,https://twitter.com/dog_rates/status/883360690899218434/photo/1,13.0,Grizzwald,07-07-2017,4,floofer,3509,21898,https://pbs.twimg.com/media/DEJT3FeXoAAtwUy.jpg,1,2,Tibetan Mastiff,0.00709872,True
883360690899218434,2017-07-07 16:22:55,Twitter for iPhone,Meet Grizzwald. He may be the floofiest floofer I ever did see. Lost eyes saving a schoolbus from a volcano erpuption. 13/10 heroic as h*ck,https://twitter.com/dog_rates/status/883360690899218434/photo/1,13.0,Grizzwald,07-07-2017,4,floofer,3509,21898,https://pbs.twimg.com/media/DEJT3FeXoAAtwUy.jpg,1,3,Newfoundland,0.00214033,True
883117836046086144,2017-07-07 00:17:54,Twitter for iPhone,"Please only send dogs. We don't rate mechanics, no matter how h*ckin good. Thank you... 13/10 would sneak a pat","https://twitter.com/dog_rates/status/883117836046086144/photo/1,https://twitter.com/dog_rates/status/883117836046086144/photo/1",13.0,dog doe,07-07-2017,4,unknown,6300,35854,https://pbs.twimg.com/media/DEF2-_hXoAAs62q.jpg,2,1,Golden Retriever,0.949562,True
883117836046086144,2017-07-07 00:17:54,Twitter for iPhone,"Please only send dogs. We don't rate mechanics, no matter how h*ckin good. Thank you... 13/10 would sneak a pat","https://twitter.com/dog_rates/status/883117836046086144/photo/1,https://twitter.com/dog_rates/status/883117836046086144/photo/1",13.0,dog doe,07-07-2017,4,unknown,6300,35854,https://pbs.twimg.com/media/DEF2-_hXoAAs62q.jpg,2,2,Labrador Retriever,0.045947900000000014,True
883117836046086144,2017-07-07 00:17:54,Twitter for iPhone,"Please only send dogs. We don't rate mechanics, no matter how h*ckin good. Thank you... 13/10 would sneak a pat","https://twitter.com/dog_rates/status/883117836046086144/photo/1,https://twitter.com/dog_rates/status/883117836046086144/photo/1",13.0,dog doe,07-07-2017,4,unknown,6300,35854,https://pbs.twimg.com/media/DEF2-_hXoAAs62q.jpg,2,3,Kuvasz,0.00247094,True
882992080364220416,2017-07-06 15:58:11,Twitter for iPhone,This is Rusty. He wasn't ready for the first pic. Clearly puppared for the second. 13/10 confirmed great boy,"https://twitter.com/dog_rates/status/882992080364220416/photo/1,https://twitter.com/dog_rates/status/882992080364220416/photo/1",13.0,Rusty,07-06-2017,3,unknown,3704,23071,https://pbs.twimg.com/media/DEEEnIqXYAAiJh_.jpg,1,1,Eskimo Dog,0.466778,True
882992080364220416,2017-07-06 15:58:11,Twitter for iPhone,This is Rusty. He wasn't ready for the first pic. Clearly puppared for the second. 13/10 confirmed great boy,"https://twitter.com/dog_rates/status/882992080364220416/photo/1,https://twitter.com/dog_rates/status/882992080364220416/photo/1",13.0,Rusty,07-06-2017,3,unknown,3704,23071,https://pbs.twimg.com/media/DEEEnIqXYAAiJh_.jpg,1,2,Siberian Husky,0.406044,True
882992080364220416,2017-07-06 15:58:11,Twitter for iPhone,This is Rusty. He wasn't ready for the first pic. Clearly puppared for the second. 13/10 confirmed great boy,"https://twitter.com/dog_rates/status/882992080364220416/photo/1,https://twitter.com/dog_rates/status/882992080364220416/photo/1",13.0,Rusty,07-06-2017,3,unknown,3704,23071,https://pbs.twimg.com/media/DEEEnIqXYAAiJh_.jpg,1,3,Dingo,0.07341439999999999,False
882762694511734784,2017-07-06 00:46:41,Twitter for iPhone,This is Gus. He's quite the cheeky pupper. Already perfected the disinterested wink. 12/10 would let steal my girl,https://twitter.com/dog_rates/status/882762694511734784/photo/1,12.0,Gus,07-06-2017,3,pupper,4629,27292,https://pbs.twimg.com/media/DEAz_HHXsAA-p_z.jpg,1,1,Labrador Retriever,0.85005,True
882762694511734784,2017-07-06 00:46:41,Twitter for iPhone,This is Gus. He's quite the cheeky pupper. Already perfected the disinterested wink. 12/10 would let steal my girl,https://twitter.com/dog_rates/status/882762694511734784/photo/1,12.0,Gus,07-06-2017,3,pupper,4629,27292,https://pbs.twimg.com/media/DEAz_HHXsAA-p_z.jpg,1,2,Chesapeake Bay Retriever,0.074257,True
882762694511734784,2017-07-06 00:46:41,Twitter for iPhone,This is Gus. He's quite the cheeky pupper. Already perfected the disinterested wink. 12/10 would let steal my girl,https://twitter.com/dog_rates/status/882762694511734784/photo/1,12.0,Gus,07-06-2017,3,pupper,4629,27292,https://pbs.twimg.com/media/DEAz_HHXsAA-p_z.jpg,1,3,Flat Coated Retriever,0.015579399999999997,True
882627270321602560,2017-07-05 15:48:34,Twitter for iPhone,This is Stanley. He has his first swim lesson today. Doggle straps adjusted. Ready to go. 13/10 Phelps is nervous (IG: stanleythe_corgi),https://twitter.com/dog_rates/status/882627270321602560/photo/1,13.0,Stanley,07-05-2017,2,unknown,5753,26969,https://pbs.twimg.com/media/DD-40X3WAAAJPU5.jpg,1,1,Pembroke,0.542982,True
882627270321602560,2017-07-05 15:48:34,Twitter for iPhone,This is Stanley. He has his first swim lesson today. Doggle straps adjusted. Ready to go. 13/10 Phelps is nervous (IG: stanleythe_corgi),https://twitter.com/dog_rates/status/882627270321602560/photo/1,13.0,Stanley,07-05-2017,2,unknown,5753,26969,https://pbs.twimg.com/media/DD-40X3WAAAJPU5.jpg,1,2,Chihuahua,0.251988,True
882627270321602560,2017-07-05 15:48:34,Twitter for iPhone,This is Stanley. He has his first swim lesson today. Doggle straps adjusted. Ready to go. 13/10 Phelps is nervous (IG: stanleythe_corgi),https://twitter.com/dog_rates/status/882627270321602560/photo/1,13.0,Stanley,07-05-2017,2,unknown,5753,26969,https://pbs.twimg.com/media/DD-40X3WAAAJPU5.jpg,1,3,Cardigan,0.107699,True
882268110199369728,2017-07-04 16:01:23,Twitter for iPhone,This is Alfy. You're witnessing his first watermelon experience. I think it was a success. 13/10 happy 4th Alfy ,"https://twitter.com/dog_rates/status/882268110199369728/photo/1,https://twitter.com/dog_rates/status/882268110199369728/photo/1,https://twitter.com/dog_rates/status/882268110199369728/photo/1",13.0,Alfy,07-04-2017,1,unknown,10972,43341,https://pbs.twimg.com/media/DD5yKdPW0AArzX8.jpg,1,1,Golden Retriever,0.762211,True
882268110199369728,2017-07-04 16:01:23,Twitter for iPhone,This is Alfy. You're witnessing his first watermelon experience. I think it was a success. 13/10 happy 4th Alfy ,"https://twitter.com/dog_rates/status/882268110199369728/photo/1,https://twitter.com/dog_rates/status/882268110199369728/photo/1,https://twitter.com/dog_rates/status/882268110199369728/photo/1",13.0,Alfy,07-04-2017,1,unknown,10972,43341,https://pbs.twimg.com/media/DD5yKdPW0AArzX8.jpg,1,2,Labrador Retriever,0.0989849,True
882268110199369728,2017-07-04 16:01:23,Twitter for iPhone,This is Alfy. You're witnessing his first watermelon experience. I think it was a success. 13/10 happy 4th Alfy ,"https://twitter.com/dog_rates/status/882268110199369728/photo/1,https://twitter.com/dog_rates/status/882268110199369728/photo/1,https://twitter.com/dog_rates/status/882268110199369728/photo/1",13.0,Alfy,07-04-2017,1,unknown,10972,43341,https://pbs.twimg.com/media/DD5yKdPW0AArzX8.jpg,1,3,Cocker Spaniel,0.0171995,True
882045870035918850,2017-07-04 01:18:17,Twitter for iPhone,"This is Koko. Her owner, inspired by Barney, recently built a cart for her to use during walks if she got tired. 13/10 rest easy Koko","https://twitter.com/dog_rates/status/882045870035918850/photo/1,https://twitter.com/dog_rates/status/882045870035918850/photo/1,https://twitter.com/dog_rates/status/882045870035918850/photo/1,https://twitter.com/dog_rates/status/882045870035918850/photo/1",13.0,Koko,07-04-2017,1,unknown,4637,28293,https://pbs.twimg.com/media/DD2oCl2WAAEI_4a.jpg,1,1,Web Site,0.949591,False
882045870035918850,2017-07-04 01:18:17,Twitter for iPhone,"This is Koko. Her owner, inspired by Barney, recently built a cart for her to use during walks if she got tired. 13/10 rest easy Koko","https://twitter.com/dog_rates/status/882045870035918850/photo/1,https://twitter.com/dog_rates/status/882045870035918850/photo/1,https://twitter.com/dog_rates/status/882045870035918850/photo/1,https://twitter.com/dog_rates/status/882045870035918850/photo/1",13.0,Koko,07-04-2017,1,unknown,4637,28293,https://pbs.twimg.com/media/DD2oCl2WAAEI_4a.jpg,1,2,Dhole,0.0173258,False
882045870035918850,2017-07-04 01:18:17,Twitter for iPhone,"This is Koko. Her owner, inspired by Barney, recently built a cart for her to use during walks if she got tired. 13/10 rest easy Koko","https://twitter.com/dog_rates/status/882045870035918850/photo/1,https://twitter.com/dog_rates/status/882045870035918850/photo/1,https://twitter.com/dog_rates/status/882045870035918850/photo/1,https://twitter.com/dog_rates/status/882045870035918850/photo/1",13.0,Koko,07-04-2017,1,unknown,4637,28293,https://pbs.twimg.com/media/DD2oCl2WAAEI_4a.jpg,1,3,Golden Retriever,0.00694063,True
881906580714921986,2017-07-03 16:04:48,Twitter for iPhone,This is Rey. He's a Benebop Cumberfloof. 12/10 dangerously pettable,https://twitter.com/dog_rates/status/881906580714921986/photo/1,12.0,Rey,07-03-2017,0,unknown,3221,23466,https://pbs.twimg.com/media/DD0pWm9XcAAeSBL.jpg,1,1,Weimaraner,0.291539,True
881906580714921986,2017-07-03 16:04:48,Twitter for iPhone,This is Rey. He's a Benebop Cumberfloof. 12/10 dangerously pettable,https://twitter.com/dog_rates/status/881906580714921986/photo/1,12.0,Rey,07-03-2017,0,unknown,3221,23466,https://pbs.twimg.com/media/DD0pWm9XcAAeSBL.jpg,1,2,Chesapeake Bay Retriever,0.278966,True
881906580714921986,2017-07-03 16:04:48,Twitter for iPhone,This is Rey. He's a Benebop Cumberfloof. 12/10 dangerously pettable,https://twitter.com/dog_rates/status/881906580714921986/photo/1,12.0,Rey,07-03-2017,0,unknown,3221,23466,https://pbs.twimg.com/media/DD0pWm9XcAAeSBL.jpg,1,3,Koala,0.12701700000000002,False
881666595344535552,2017-07-03 00:11:11,Twitter for iPhone,This is Gary. He couldn't miss this puppertunity for a selfie. Flawless focusing skills. 13/10 would boop intensely,https://twitter.com/dog_rates/status/881666595344535552/photo/1,13.0,Gary,07-03-2017,0,unknown,10107,48875,https://pbs.twimg.com/media/DDxPFwbWAAEbVVR.jpg,1,1,Saluki,0.529012,True
881666595344535552,2017-07-03 00:11:11,Twitter for iPhone,This is Gary. He couldn't miss this puppertunity for a selfie. Flawless focusing skills. 13/10 would boop intensely,https://twitter.com/dog_rates/status/881666595344535552/photo/1,13.0,Gary,07-03-2017,0,unknown,10107,48875,https://pbs.twimg.com/media/DDxPFwbWAAEbVVR.jpg,1,2,Afghan Hound,0.25000300000000003,True
881666595344535552,2017-07-03 00:11:11,Twitter for iPhone,This is Gary. He couldn't miss this puppertunity for a selfie. Flawless focusing skills. 13/10 would boop intensely,https://twitter.com/dog_rates/status/881666595344535552/photo/1,13.0,Gary,07-03-2017,0,unknown,10107,48875,https://pbs.twimg.com/media/DDxPFwbWAAEbVVR.jpg,1,3,Golden Retriever,0.16073900000000002,True
881536004380872706,2017-07-02 15:32:16,Twitter for iPhone,"Here is a pupper approaching maximum borkdrive. Zooming at never before seen speeds. 14/10 paw-inspiring af 
(IG: puffie_the_chow)",https://twitter.com/dog_rates/status/881536004380872706/video/1,14.0,dog doe,07-02-2017,6,pupper,15120,47717,https://pbs.twimg.com/ext_tw_video_thumb/881535971568889856/pu/img/9bawiZ--8FKywTkz.jpg,1,1,Samoyed,0.281463,True
881536004380872706,2017-07-02 15:32:16,Twitter for iPhone,"Here is a pupper approaching maximum borkdrive. Zooming at never before seen speeds. 14/10 paw-inspiring af 
(IG: puffie_the_chow)",https://twitter.com/dog_rates/status/881536004380872706/video/1,14.0,dog doe,07-02-2017,6,pupper,15120,47717,https://pbs.twimg.com/ext_tw_video_thumb/881535971568889856/pu/img/9bawiZ--8FKywTkz.jpg,1,2,Angora,0.272066,False
881536004380872706,2017-07-02 15:32:16,Twitter for iPhone,"Here is a pupper approaching maximum borkdrive. Zooming at never before seen speeds. 14/10 paw-inspiring af 
(IG: puffie_the_chow)",https://twitter.com/dog_rates/status/881536004380872706/video/1,14.0,dog doe,07-02-2017,6,pupper,15120,47717,https://pbs.twimg.com/ext_tw_video_thumb/881535971568889856/pu/img/9bawiZ--8FKywTkz.jpg,1,3,Persian Cat,0.114854,False
881268444196462592,2017-07-01 21:49:04,Twitter for iPhone,Meet Elliot. He's a Canadian Forrest Pup. Unusual number of antlers for a dog. Sneaky tongue slip to celebrate #Canada150. 12/10 would pet,https://twitter.com/dog_rates/status/881268444196462592/photo/1,12.0,Elliot,07-01-2017,5,unknown,4950,22356,https://pbs.twimg.com/media/DDrk-f9WAAI-WQv.jpg,1,1,Tusker,0.473303,False
881268444196462592,2017-07-01 21:49:04,Twitter for iPhone,Meet Elliot. He's a Canadian Forrest Pup. Unusual number of antlers for a dog. Sneaky tongue slip to celebrate #Canada150. 12/10 would pet,https://twitter.com/dog_rates/status/881268444196462592/photo/1,12.0,Elliot,07-01-2017,5,unknown,4950,22356,https://pbs.twimg.com/media/DDrk-f9WAAI-WQv.jpg,1,2,Indian Elephant,0.245646,False
881268444196462592,2017-07-01 21:49:04,Twitter for iPhone,Meet Elliot. He's a Canadian Forrest Pup. Unusual number of antlers for a dog. Sneaky tongue slip to celebrate #Canada150. 12/10 would pet,https://twitter.com/dog_rates/status/881268444196462592/photo/1,12.0,Elliot,07-01-2017,5,unknown,4950,22356,https://pbs.twimg.com/media/DDrk-f9WAAI-WQv.jpg,1,3,Ibex,0.0556607,False
880935762899988482,2017-06-30 23:47:07,Twitter for iPhone,This is Louis. He's crossing. It's a big deal. 13/10 h*ckin breathtaking,https://twitter.com/dog_rates/status/880935762899988482/photo/1,13.0,Louis,06-30-2017,4,unknown,2641,16457,https://pbs.twimg.com/media/DDm2Z5aXUAEDS2u.jpg,1,1,Street Sign,0.251801,False
880935762899988482,2017-06-30 23:47:07,Twitter for iPhone,This is Louis. He's crossing. It's a big deal. 13/10 h*ckin breathtaking,https://twitter.com/dog_rates/status/880935762899988482/photo/1,13.0,Louis,06-30-2017,4,unknown,2641,16457,https://pbs.twimg.com/media/DDm2Z5aXUAEDS2u.jpg,1,2,Umbrella,0.115123,False
880935762899988482,2017-06-30 23:47:07,Twitter for iPhone,This is Louis. He's crossing. It's a big deal. 13/10 h*ckin breathtaking,https://twitter.com/dog_rates/status/880935762899988482/photo/1,13.0,Louis,06-30-2017,4,unknown,2641,16457,https://pbs.twimg.com/media/DDm2Z5aXUAEDS2u.jpg,1,3,Traffic Light,0.0695338,False
880872448815771648,2017-06-30 19:35:32,Twitter for iPhone,Ugh not again. We only rate dogs. Please don't send in well-dressed  floppy-tongued street penguins. Dogs only please. Thank you... 12/10,https://twitter.com/dog_rates/status/880872448815771648/photo/1,12.0,dog doe,06-30-2017,4,unknown,3623,20555,https://pbs.twimg.com/media/DDl8zzJW0AAisCJ.jpg,1,1,Pembroke,0.791416,True
880872448815771648,2017-06-30 19:35:32,Twitter for iPhone,Ugh not again. We only rate dogs. Please don't send in well-dressed  floppy-tongued street penguins. Dogs only please. Thank you... 12/10,https://twitter.com/dog_rates/status/880872448815771648/photo/1,12.0,dog doe,06-30-2017,4,unknown,3623,20555,https://pbs.twimg.com/media/DDl8zzJW0AAisCJ.jpg,1,2,Norwich Terrier,0.0613929,True
880872448815771648,2017-06-30 19:35:32,Twitter for iPhone,Ugh not again. We only rate dogs. Please don't send in well-dressed  floppy-tongued street penguins. Dogs only please. Thank you... 12/10,https://twitter.com/dog_rates/status/880872448815771648/photo/1,12.0,dog doe,06-30-2017,4,unknown,3623,20555,https://pbs.twimg.com/media/DDl8zzJW0AAisCJ.jpg,1,3,Chihuahua,0.0337257,True
880465832366813184,2017-06-29 16:39:47,Twitter for iPhone,This is Bella. She had her first beach experience this morning. Complete success. 12/10 would perform a sandy boop,"https://twitter.com/dog_rates/status/880465832366813184/photo/1,https://twitter.com/dog_rates/status/880465832366813184/photo/1,https://twitter.com/dog_rates/status/880465832366813184/photo/1,https://twitter.com/dog_rates/status/880465832366813184/photo/1",12.0,Bella,06-29-2017,3,unknown,5908,27528,https://pbs.twimg.com/media/DDgK-J4XUAIEV9W.jpg,1,1,Golden Retriever,0.913255,True
880465832366813184,2017-06-29 16:39:47,Twitter for iPhone,This is Bella. She had her first beach experience this morning. Complete success. 12/10 would perform a sandy boop,"https://twitter.com/dog_rates/status/880465832366813184/photo/1,https://twitter.com/dog_rates/status/880465832366813184/photo/1,https://twitter.com/dog_rates/status/880465832366813184/photo/1,https://twitter.com/dog_rates/status/880465832366813184/photo/1",12.0,Bella,06-29-2017,3,unknown,5908,27528,https://pbs.twimg.com/media/DDgK-J4XUAIEV9W.jpg,1,2,Labrador Retriever,0.0263286,True
880465832366813184,2017-06-29 16:39:47,Twitter for iPhone,This is Bella. She had her first beach experience this morning. Complete success. 12/10 would perform a sandy boop,"https://twitter.com/dog_rates/status/880465832366813184/photo/1,https://twitter.com/dog_rates/status/880465832366813184/photo/1,https://twitter.com/dog_rates/status/880465832366813184/photo/1,https://twitter.com/dog_rates/status/880465832366813184/photo/1",12.0,Bella,06-29-2017,3,unknown,5908,27528,https://pbs.twimg.com/media/DDgK-J4XUAIEV9W.jpg,1,3,Cocker Spaniel,0.00937082,True
880221127280381952,2017-06-29 00:27:25,Twitter for iPhone,Meet Jesse. He's a Fetty Woof. His tongue ejects without warning. A true bleptomaniac. 12/10 would snug well,"https://twitter.com/dog_rates/status/880221127280381952/photo/1,https://twitter.com/dog_rates/status/880221127280381952/photo/1",12.0,Jesse,06-29-2017,3,unknown,3987,26074,https://pbs.twimg.com/media/DDcscbXU0AIfDzs.jpg,1,1,Chihuahua,0.238525,True
880221127280381952,2017-06-29 00:27:25,Twitter for iPhone,Meet Jesse. He's a Fetty Woof. His tongue ejects without warning. A true bleptomaniac. 12/10 would snug well,"https://twitter.com/dog_rates/status/880221127280381952/photo/1,https://twitter.com/dog_rates/status/880221127280381952/photo/1",12.0,Jesse,06-29-2017,3,unknown,3987,26074,https://pbs.twimg.com/media/DDcscbXU0AIfDzs.jpg,1,2,Meerkat,0.104256,False
880221127280381952,2017-06-29 00:27:25,Twitter for iPhone,Meet Jesse. He's a Fetty Woof. His tongue ejects without warning. A true bleptomaniac. 12/10 would snug well,"https://twitter.com/dog_rates/status/880221127280381952/photo/1,https://twitter.com/dog_rates/status/880221127280381952/photo/1",12.0,Jesse,06-29-2017,3,unknown,3987,26074,https://pbs.twimg.com/media/DDcscbXU0AIfDzs.jpg,1,3,Clumber,0.0525803,True
880095782870896641,2017-06-28 16:09:20,Twitter for iPhone,Please don't send in photos without dogs in them. We're not @porch_rates. Insubordinate and churlish. Pretty good porch tho 11/10,https://twitter.com/dog_rates/status/880095782870896641/photo/1,11.0,dog doe,06-28-2017,2,unknown,4107,26677,https://pbs.twimg.com/media/DDa6ckbXgAAM1vV.jpg,1,1,Miniature Pinscher,0.120298,True
880095782870896641,2017-06-28 16:09:20,Twitter for iPhone,Please don't send in photos without dogs in them. We're not @porch_rates. Insubordinate and churlish. Pretty good porch tho 11/10,https://twitter.com/dog_rates/status/880095782870896641/photo/1,11.0,dog doe,06-28-2017,2,unknown,4107,26677,https://pbs.twimg.com/media/DDa6ckbXgAAM1vV.jpg,1,2,Rhodesian Ridgeback,0.106395,True
880095782870896641,2017-06-28 16:09:20,Twitter for iPhone,Please don't send in photos without dogs in them. We're not @porch_rates. Insubordinate and churlish. Pretty good porch tho 11/10,https://twitter.com/dog_rates/status/880095782870896641/photo/1,11.0,dog doe,06-28-2017,2,unknown,4107,26677,https://pbs.twimg.com/media/DDa6ckbXgAAM1vV.jpg,1,3,Beagle,0.106073,True
879862464715927552,2017-06-28 00:42:13,Twitter for iPhone,This is Romeo. He would like to do an entrance. Requesting your immediate assistance. 13/10,"https://twitter.com/dog_rates/status/879862464715927552/photo/1,https://twitter.com/dog_rates/status/879862464715927552/photo/1,https://twitter.com/dog_rates/status/879862464715927552/photo/1",13.0,Romeo,06-28-2017,2,unknown,3305,21570,https://pbs.twimg.com/media/DDXmPrbWAAEKMvy.jpg,3,1,Basset,0.813507,True
879862464715927552,2017-06-28 00:42:13,Twitter for iPhone,This is Romeo. He would like to do an entrance. Requesting your immediate assistance. 13/10,"https://twitter.com/dog_rates/status/879862464715927552/photo/1,https://twitter.com/dog_rates/status/879862464715927552/photo/1,https://twitter.com/dog_rates/status/879862464715927552/photo/1",13.0,Romeo,06-28-2017,2,unknown,3305,21570,https://pbs.twimg.com/media/DDXmPrbWAAEKMvy.jpg,3,2,Beagle,0.146654,True
879862464715927552,2017-06-28 00:42:13,Twitter for iPhone,This is Romeo. He would like to do an entrance. Requesting your immediate assistance. 13/10,"https://twitter.com/dog_rates/status/879862464715927552/photo/1,https://twitter.com/dog_rates/status/879862464715927552/photo/1,https://twitter.com/dog_rates/status/879862464715927552/photo/1",13.0,Romeo,06-28-2017,2,unknown,3305,21570,https://pbs.twimg.com/media/DDXmPrbWAAEKMvy.jpg,3,3,Cocker Spaniel,0.00948502,True
879492040517615616,2017-06-27 00:10:17,Twitter for iPhone,This is Bailey. He thinks you should measure ear length for signs of growth instead. 12/10,https://twitter.com/dog_rates/status/879492040517615616/photo/1,12.0,Bailey,06-27-2017,1,unknown,3014,22657,https://pbs.twimg.com/media/DDSVWMvXsAEgmMK.jpg,1,1,German Short Haired Pointer,0.479896,True
879492040517615616,2017-06-27 00:10:17,Twitter for iPhone,This is Bailey. He thinks you should measure ear length for signs of growth instead. 12/10,https://twitter.com/dog_rates/status/879492040517615616/photo/1,12.0,Bailey,06-27-2017,1,unknown,3014,22657,https://pbs.twimg.com/media/DDSVWMvXsAEgmMK.jpg,1,2,Vizsla,0.124353,True
879492040517615616,2017-06-27 00:10:17,Twitter for iPhone,This is Bailey. He thinks you should measure ear length for signs of growth instead. 12/10,https://twitter.com/dog_rates/status/879492040517615616/photo/1,12.0,Bailey,06-27-2017,1,unknown,3014,22657,https://pbs.twimg.com/media/DDSVWMvXsAEgmMK.jpg,1,3,Bath Towel,0.0733202,False
879415818425184262,2017-06-26 19:07:24,Twitter for iPhone,This is Duddles. He did an attempt. 13/10 someone help him (vid by Georgia Felici),https://twitter.com/dog_rates/status/879415818425184262/video/1,13.0,Duddles,06-26-2017,0,unknown,42062,102226,https://pbs.twimg.com/ext_tw_video_thumb/879415784908390401/pu/img/cX7XI1TnUsseGET5.jpg,1,1,English Springer,0.383404,True
879415818425184262,2017-06-26 19:07:24,Twitter for iPhone,This is Duddles. He did an attempt. 13/10 someone help him (vid by Georgia Felici),https://twitter.com/dog_rates/status/879415818425184262/video/1,13.0,Duddles,06-26-2017,0,unknown,42062,102226,https://pbs.twimg.com/ext_tw_video_thumb/879415784908390401/pu/img/cX7XI1TnUsseGET5.jpg,1,2,Boston Bull,0.134967,True
879415818425184262,2017-06-26 19:07:24,Twitter for iPhone,This is Duddles. He did an attempt. 13/10 someone help him (vid by Georgia Felici),https://twitter.com/dog_rates/status/879415818425184262/video/1,13.0,Duddles,06-26-2017,0,unknown,42062,102226,https://pbs.twimg.com/ext_tw_video_thumb/879415784908390401/pu/img/cX7XI1TnUsseGET5.jpg,1,3,Cardigan,0.110481,True
879376492567855104,2017-06-26 16:31:08,Twitter for iPhone,This is Jack AKA Stephen Furry. You're not scoring on him. Unless he slips down the slide. 12/10 would happily get blocked by,https://twitter.com/dog_rates/status/879376492567855104/photo/1,12.0,Jack,06-26-2017,0,unknown,2953,16239,https://pbs.twimg.com/media/DDQsQGFV0AAw6u9.jpg,1,1,Tricycle,0.663601,False
879376492567855104,2017-06-26 16:31:08,Twitter for iPhone,This is Jack AKA Stephen Furry. You're not scoring on him. Unless he slips down the slide. 12/10 would happily get blocked by,https://twitter.com/dog_rates/status/879376492567855104/photo/1,12.0,Jack,06-26-2017,0,unknown,2953,16239,https://pbs.twimg.com/media/DDQsQGFV0AAw6u9.jpg,1,2,Labrador Retriever,0.0334961,True
879376492567855104,2017-06-26 16:31:08,Twitter for iPhone,This is Jack AKA Stephen Furry. You're not scoring on him. Unless he slips down the slide. 12/10 would happily get blocked by,https://twitter.com/dog_rates/status/879376492567855104/photo/1,12.0,Jack,06-26-2017,0,unknown,2953,16239,https://pbs.twimg.com/media/DDQsQGFV0AAw6u9.jpg,1,3,Pembroke,0.0188266,True
879050749262655488,2017-06-25 18:56:45,Twitter for iPhone,This is Steven. He has trouble relating to other dogs. Quite shy. Neck longer than average. Tropical probably. 11/10 would still pet,https://twitter.com/dog_rates/status/879050749262655488/photo/1,11.0,Steven,06-25-2017,6,unknown,4446,21768,https://pbs.twimg.com/media/DDMD_phXoAQ1qf0.jpg,1,1,Tabby,0.311861,False
879050749262655488,2017-06-25 18:56:45,Twitter for iPhone,This is Steven. He has trouble relating to other dogs. Quite shy. Neck longer than average. Tropical probably. 11/10 would still pet,https://twitter.com/dog_rates/status/879050749262655488/photo/1,11.0,Steven,06-25-2017,6,unknown,4446,21768,https://pbs.twimg.com/media/DDMD_phXoAQ1qf0.jpg,1,2,Window Screen,0.169123,False
879050749262655488,2017-06-25 18:56:45,Twitter for iPhone,This is Steven. He has trouble relating to other dogs. Quite shy. Neck longer than average. Tropical probably. 11/10 would still pet,https://twitter.com/dog_rates/status/879050749262655488/photo/1,11.0,Steven,06-25-2017,6,unknown,4446,21768,https://pbs.twimg.com/media/DDMD_phXoAQ1qf0.jpg,1,3,Egyptian Cat,0.132932,False
879008229531029506,2017-06-25 16:07:47,Twitter for iPhone,This is Beau. That is Beau's balloon. He takes it everywhere. 13/10 would protect at all costs,https://twitter.com/dog_rates/status/879008229531029506/photo/1,13.0,Beau,06-25-2017,6,unknown,2552,18329,https://pbs.twimg.com/media/DDLdUrqXYAMOVzY.jpg,1,1,Vizsla,0.960513,True
879008229531029506,2017-06-25 16:07:47,Twitter for iPhone,This is Beau. That is Beau's balloon. He takes it everywhere. 13/10 would protect at all costs,https://twitter.com/dog_rates/status/879008229531029506/photo/1,13.0,Beau,06-25-2017,6,unknown,2552,18329,https://pbs.twimg.com/media/DDLdUrqXYAMOVzY.jpg,1,2,Miniature Pinscher,0.00943065,True
879008229531029506,2017-06-25 16:07:47,Twitter for iPhone,This is Beau. That is Beau's balloon. He takes it everywhere. 13/10 would protect at all costs,https://twitter.com/dog_rates/status/879008229531029506/photo/1,13.0,Beau,06-25-2017,6,unknown,2552,18329,https://pbs.twimg.com/media/DDLdUrqXYAMOVzY.jpg,1,3,American Staffordshire Terrier,0.0087113,True
878776093423087618,2017-06-25 00:45:22,Twitter for iPhone,This is Snoopy. He's a proud #PrideMonthPuppo. Impeccable handwriting for not having thumbs. 13/10 would love back #PrideMonth,"https://twitter.com/dog_rates/status/878776093423087618/photo/1,https://twitter.com/dog_rates/status/878776093423087618/photo/1",13.0,Snoopy,06-25-2017,6,puppo,3904,18736,https://pbs.twimg.com/media/DDIKMXzW0AEibje.jpg,2,1,Italian Greyhound,0.734684,True
878776093423087618,2017-06-25 00:45:22,Twitter for iPhone,This is Snoopy. He's a proud #PrideMonthPuppo. Impeccable handwriting for not having thumbs. 13/10 would love back #PrideMonth,"https://twitter.com/dog_rates/status/878776093423087618/photo/1,https://twitter.com/dog_rates/status/878776093423087618/photo/1",13.0,Snoopy,06-25-2017,6,puppo,3904,18736,https://pbs.twimg.com/media/DDIKMXzW0AEibje.jpg,2,2,Whippet,0.15048699999999998,True
878776093423087618,2017-06-25 00:45:22,Twitter for iPhone,This is Snoopy. He's a proud #PrideMonthPuppo. Impeccable handwriting for not having thumbs. 13/10 would love back #PrideMonth,"https://twitter.com/dog_rates/status/878776093423087618/photo/1,https://twitter.com/dog_rates/status/878776093423087618/photo/1",13.0,Snoopy,06-25-2017,6,puppo,3904,18736,https://pbs.twimg.com/media/DDIKMXzW0AEibje.jpg,2,3,Ibizan Hound,0.0397246,True
878281511006478336,2017-06-23 16:00:04,Twitter for iPhone,"Meet Shadow. In an attempt to reach maximum zooming borkdrive, he tore his ACL. Still 13/10 tho. Help him out below
","https://www.gofundme.com/3yd6y1c,https://twitter.com/dog_rates/status/878281511006478336/photo/1",13.0,Shadow,06-23-2017,4,unknown,1228,7473,https://pbs.twimg.com/media/DDBIX9QVYAAohGa.jpg,1,1,Basset,0.32042,True
878281511006478336,2017-06-23 16:00:04,Twitter for iPhone,"Meet Shadow. In an attempt to reach maximum zooming borkdrive, he tore his ACL. Still 13/10 tho. Help him out below
","https://www.gofundme.com/3yd6y1c,https://twitter.com/dog_rates/status/878281511006478336/photo/1",13.0,Shadow,06-23-2017,4,unknown,1228,7473,https://pbs.twimg.com/media/DDBIX9QVYAAohGa.jpg,1,2,Collie,0.215975,True
878281511006478336,2017-06-23 16:00:04,Twitter for iPhone,"Meet Shadow. In an attempt to reach maximum zooming borkdrive, he tore his ACL. Still 13/10 tho. Help him out below
","https://www.gofundme.com/3yd6y1c,https://twitter.com/dog_rates/status/878281511006478336/photo/1",13.0,Shadow,06-23-2017,4,unknown,1228,7473,https://pbs.twimg.com/media/DDBIX9QVYAAohGa.jpg,1,3,Appenzeller,0.12850699999999998,True
878057613040115712,2017-06-23 01:10:23,Twitter for iPhone,This is Emmy. She was adopted today. Massive round of pupplause for Emmy and her new family. 14/10 for all involved,"https://twitter.com/dog_rates/status/878057613040115712/photo/1,https://twitter.com/dog_rates/status/878057613040115712/photo/1",14.0,Emmy,06-23-2017,4,unknown,6461,40644,https://pbs.twimg.com/media/DC98vABUIAA97pz.jpg,1,1,French Bulldog,0.839097,True
878057613040115712,2017-06-23 01:10:23,Twitter for iPhone,This is Emmy. She was adopted today. Massive round of pupplause for Emmy and her new family. 14/10 for all involved,"https://twitter.com/dog_rates/status/878057613040115712/photo/1,https://twitter.com/dog_rates/status/878057613040115712/photo/1",14.0,Emmy,06-23-2017,4,unknown,6461,40644,https://pbs.twimg.com/media/DC98vABUIAA97pz.jpg,1,2,Boston Bull,0.07879939999999999,True
878057613040115712,2017-06-23 01:10:23,Twitter for iPhone,This is Emmy. She was adopted today. Massive round of pupplause for Emmy and her new family. 14/10 for all involved,"https://twitter.com/dog_rates/status/878057613040115712/photo/1,https://twitter.com/dog_rates/status/878057613040115712/photo/1",14.0,Emmy,06-23-2017,4,unknown,6461,40644,https://pbs.twimg.com/media/DC98vABUIAA97pz.jpg,1,3,Toy Terrier,0.0152434,True
877736472329191424,2017-06-22 03:54:17,Twitter for iPhone,This is Aja. She was just told she's a good dog. Suspicions confirmed. 13/10 would tell again,"https://twitter.com/dog_rates/status/877736472329191424/photo/1,https://twitter.com/dog_rates/status/877736472329191424/photo/1",13.0,Aja,06-22-2017,3,unknown,18068,76942,https://pbs.twimg.com/media/DC5YqoQW0AArOLH.jpg,2,1,Chesapeake Bay Retriever,0.8379559999999999,True
877736472329191424,2017-06-22 03:54:17,Twitter for iPhone,This is Aja. She was just told she's a good dog. Suspicions confirmed. 13/10 would tell again,"https://twitter.com/dog_rates/status/877736472329191424/photo/1,https://twitter.com/dog_rates/status/877736472329191424/photo/1",13.0,Aja,06-22-2017,3,unknown,18068,76942,https://pbs.twimg.com/media/DC5YqoQW0AArOLH.jpg,2,2,Labrador Retriever,0.0620342,True
877736472329191424,2017-06-22 03:54:17,Twitter for iPhone,This is Aja. She was just told she's a good dog. Suspicions confirmed. 13/10 would tell again,"https://twitter.com/dog_rates/status/877736472329191424/photo/1,https://twitter.com/dog_rates/status/877736472329191424/photo/1",13.0,Aja,06-22-2017,3,unknown,18068,76942,https://pbs.twimg.com/media/DC5YqoQW0AArOLH.jpg,2,3,Weimaraner,0.0405991,True
877556246731214848,2017-06-21 15:58:08,Twitter for iPhone,This is Penny. She's both pupset and fired pup. Not pleased w your barbaric attempts at cleanliness. 12/10 would enjoy more shampoo options,https://twitter.com/dog_rates/status/877556246731214848/photo/1,12.0,Penny,06-21-2017,2,unknown,3623,21950,https://pbs.twimg.com/media/DC20wEcW0AAf59m.jpg,1,1,Basset,0.995368,True
877556246731214848,2017-06-21 15:58:08,Twitter for iPhone,This is Penny. She's both pupset and fired pup. Not pleased w your barbaric attempts at cleanliness. 12/10 would enjoy more shampoo options,https://twitter.com/dog_rates/status/877556246731214848/photo/1,12.0,Penny,06-21-2017,2,unknown,3623,21950,https://pbs.twimg.com/media/DC20wEcW0AAf59m.jpg,1,2,Welsh Springer Spaniel,0.00193621,True
877556246731214848,2017-06-21 15:58:08,Twitter for iPhone,This is Penny. She's both pupset and fired pup. Not pleased w your barbaric attempts at cleanliness. 12/10 would enjoy more shampoo options,https://twitter.com/dog_rates/status/877556246731214848/photo/1,12.0,Penny,06-21-2017,2,unknown,3623,21950,https://pbs.twimg.com/media/DC20wEcW0AAf59m.jpg,1,3,Bathtub,0.000467919,False
877316821321428993,2017-06-21 00:06:44,Twitter for iPhone,"Meet Dante. At first he wasn't a fan of his new raincoat, then he saw his reflection. H*ckin handsome. 13/10 for water resistant good boy","https://twitter.com/dog_rates/status/877316821321428993/photo/1,https://twitter.com/dog_rates/status/877316821321428993/photo/1",13.0,Dante,06-21-2017,2,unknown,4923,26485,https://pbs.twimg.com/media/DCza_vtXkAQXGpC.jpg,1,1,Saluki,0.5099670000000001,True
877316821321428993,2017-06-21 00:06:44,Twitter for iPhone,"Meet Dante. At first he wasn't a fan of his new raincoat, then he saw his reflection. H*ckin handsome. 13/10 for water resistant good boy","https://twitter.com/dog_rates/status/877316821321428993/photo/1,https://twitter.com/dog_rates/status/877316821321428993/photo/1",13.0,Dante,06-21-2017,2,unknown,4923,26485,https://pbs.twimg.com/media/DCza_vtXkAQXGpC.jpg,1,2,Italian Greyhound,0.0904973,True
877316821321428993,2017-06-21 00:06:44,Twitter for iPhone,"Meet Dante. At first he wasn't a fan of his new raincoat, then he saw his reflection. H*ckin handsome. 13/10 for water resistant good boy","https://twitter.com/dog_rates/status/877316821321428993/photo/1,https://twitter.com/dog_rates/status/877316821321428993/photo/1",13.0,Dante,06-21-2017,2,unknown,4923,26485,https://pbs.twimg.com/media/DCza_vtXkAQXGpC.jpg,1,3,Golden Retriever,0.0794058,True
877201837425926144,2017-06-20 16:29:50,Twitter for iPhone,This is Nelly. He graduated with his dogtorate today. Wants to know if you're proud of him. 12/10 would give congratulatory boop,"https://twitter.com/dog_rates/status/877201837425926144/photo/1,https://twitter.com/dog_rates/status/877201837425926144/photo/1",12.0,Nelly,06-20-2017,1,unknown,5308,26207,https://pbs.twimg.com/media/DCxyahJWsAAddSC.jpg,1,1,Pembroke,0.93112,True
877201837425926144,2017-06-20 16:29:50,Twitter for iPhone,This is Nelly. He graduated with his dogtorate today. Wants to know if you're proud of him. 12/10 would give congratulatory boop,"https://twitter.com/dog_rates/status/877201837425926144/photo/1,https://twitter.com/dog_rates/status/877201837425926144/photo/1",12.0,Nelly,06-20-2017,1,unknown,5308,26207,https://pbs.twimg.com/media/DCxyahJWsAAddSC.jpg,1,2,Cardigan,0.0686982,True
877201837425926144,2017-06-20 16:29:50,Twitter for iPhone,This is Nelly. He graduated with his dogtorate today. Wants to know if you're proud of him. 12/10 would give congratulatory boop,"https://twitter.com/dog_rates/status/877201837425926144/photo/1,https://twitter.com/dog_rates/status/877201837425926144/photo/1",12.0,Nelly,06-20-2017,1,unknown,5308,26207,https://pbs.twimg.com/media/DCxyahJWsAAddSC.jpg,1,3,Basenji,8.17379e-05,True
876838120628539392,2017-06-19 16:24:33,Twitter for iPhone,This is Ginger. She's having a ruff Monday. Too many pupper things going on. H*ckin exhausting. 12/10 would snug passionately,"https://twitter.com/dog_rates/status/876838120628539392/photo/1,https://twitter.com/dog_rates/status/876838120628539392/photo/1",12.0,Ginger,06-19-2017,0,pupper,3174,20019,https://pbs.twimg.com/media/DCsnnZsVwAEfkyi.jpg,1,1,Bloodhound,0.575751,True
876838120628539392,2017-06-19 16:24:33,Twitter for iPhone,This is Ginger. She's having a ruff Monday. Too many pupper things going on. H*ckin exhausting. 12/10 would snug passionately,"https://twitter.com/dog_rates/status/876838120628539392/photo/1,https://twitter.com/dog_rates/status/876838120628539392/photo/1",12.0,Ginger,06-19-2017,0,pupper,3174,20019,https://pbs.twimg.com/media/DCsnnZsVwAEfkyi.jpg,1,2,Redbone,0.24097,True
876838120628539392,2017-06-19 16:24:33,Twitter for iPhone,This is Ginger. She's having a ruff Monday. Too many pupper things going on. H*ckin exhausting. 12/10 would snug passionately,"https://twitter.com/dog_rates/status/876838120628539392/photo/1,https://twitter.com/dog_rates/status/876838120628539392/photo/1",12.0,Ginger,06-19-2017,0,pupper,3174,20019,https://pbs.twimg.com/media/DCsnnZsVwAEfkyi.jpg,1,3,Tibetan Mastiff,0.08893480000000001,True
876484053909872640,2017-06-18 16:57:37,Twitter for iPhone,This is Benedict. He wants to thank you for this delightful urban walk. Hopes you know he loves you. 13/10 super duper good boy,https://twitter.com/dog_rates/status/876484053909872640/photo/1,13.0,Benedict,06-18-2017,6,unknown,2269,18151,https://pbs.twimg.com/media/DCnll_dUQAAkBdG.jpg,1,1,Golden Retriever,0.874566,True
876484053909872640,2017-06-18 16:57:37,Twitter for iPhone,This is Benedict. He wants to thank you for this delightful urban walk. Hopes you know he loves you. 13/10 super duper good boy,https://twitter.com/dog_rates/status/876484053909872640/photo/1,13.0,Benedict,06-18-2017,6,unknown,2269,18151,https://pbs.twimg.com/media/DCnll_dUQAAkBdG.jpg,1,2,Irish Terrier,0.0373542,True
876484053909872640,2017-06-18 16:57:37,Twitter for iPhone,This is Benedict. He wants to thank you for this delightful urban walk. Hopes you know he loves you. 13/10 super duper good boy,https://twitter.com/dog_rates/status/876484053909872640/photo/1,13.0,Benedict,06-18-2017,6,unknown,2269,18151,https://pbs.twimg.com/media/DCnll_dUQAAkBdG.jpg,1,3,Chow,0.016723599999999998,True
876120275196170240,2017-06-17 16:52:05,Twitter for iPhone,"Meet Venti, a seemingly caffeinated puppoccino. She was just informed the weekend would include walks, pats and scritches. 13/10 much excite",https://twitter.com/dog_rates/status/876120275196170240/photo/1,13.0,Venti,06-17-2017,5,unknown,4448,27012,https://pbs.twimg.com/media/DCiavj_UwAAcXep.jpg,1,1,Bernese Mountain Dog,0.534327,True
876120275196170240,2017-06-17 16:52:05,Twitter for iPhone,"Meet Venti, a seemingly caffeinated puppoccino. She was just informed the weekend would include walks, pats and scritches. 13/10 much excite",https://twitter.com/dog_rates/status/876120275196170240/photo/1,13.0,Venti,06-17-2017,5,unknown,4448,27012,https://pbs.twimg.com/media/DCiavj_UwAAcXep.jpg,1,2,Saint Bernard,0.346312,True
876120275196170240,2017-06-17 16:52:05,Twitter for iPhone,"Meet Venti, a seemingly caffeinated puppoccino. She was just informed the weekend would include walks, pats and scritches. 13/10 much excite",https://twitter.com/dog_rates/status/876120275196170240/photo/1,13.0,Venti,06-17-2017,5,unknown,4448,27012,https://pbs.twimg.com/media/DCiavj_UwAAcXep.jpg,1,3,Greater Swiss Mountain Dog,0.0949327,True
875747767867523072,2017-06-16 16:11:53,Twitter for iPhone,"This is Goose. He's a womanizer. Cheeky as h*ck, but also deep. Tongue slip game on another level. 13/10 will steal your girl",https://twitter.com/dog_rates/status/875747767867523072/photo/1,13.0,Goose,06-16-2017,4,unknown,4065,24344,https://pbs.twimg.com/media/DCdH8YpUQAAiEbL.jpg,1,1,Labrador Retriever,0.799551,True
875747767867523072,2017-06-16 16:11:53,Twitter for iPhone,"This is Goose. He's a womanizer. Cheeky as h*ck, but also deep. Tongue slip game on another level. 13/10 will steal your girl",https://twitter.com/dog_rates/status/875747767867523072/photo/1,13.0,Goose,06-16-2017,4,unknown,4065,24344,https://pbs.twimg.com/media/DCdH8YpUQAAiEbL.jpg,1,2,Chesapeake Bay Retriever,0.179975,True
875747767867523072,2017-06-16 16:11:53,Twitter for iPhone,"This is Goose. He's a womanizer. Cheeky as h*ck, but also deep. Tongue slip game on another level. 13/10 will steal your girl",https://twitter.com/dog_rates/status/875747767867523072/photo/1,13.0,Goose,06-16-2017,4,unknown,4065,24344,https://pbs.twimg.com/media/DCdH8YpUQAAiEbL.jpg,1,3,Vizsla,0.0046176,True
875144289856114688,2017-06-15 00:13:52,Twitter for iPhone,Meet Nugget and Hank. Nugget took Hank's bone. Hank is wondering if you would please return it to him. Both 13/10 would not intervene,https://twitter.com/dog_rates/status/875144289856114688/video/1,13.0,Nugget,06-15-2017,3,unknown,4691,21216,https://pbs.twimg.com/ext_tw_video_thumb/875144175078957056/pu/img/BRi_l7vUdpb93Knf.jpg,1,1,Siberian Husky,0.245048,True
875144289856114688,2017-06-15 00:13:52,Twitter for iPhone,Meet Nugget and Hank. Nugget took Hank's bone. Hank is wondering if you would please return it to him. Both 13/10 would not intervene,https://twitter.com/dog_rates/status/875144289856114688/video/1,13.0,Nugget,06-15-2017,3,unknown,4691,21216,https://pbs.twimg.com/ext_tw_video_thumb/875144175078957056/pu/img/BRi_l7vUdpb93Knf.jpg,1,2,Pembroke,0.223716,True
875144289856114688,2017-06-15 00:13:52,Twitter for iPhone,Meet Nugget and Hank. Nugget took Hank's bone. Hank is wondering if you would please return it to him. Both 13/10 would not intervene,https://twitter.com/dog_rates/status/875144289856114688/video/1,13.0,Nugget,06-15-2017,3,unknown,4691,21216,https://pbs.twimg.com/ext_tw_video_thumb/875144175078957056/pu/img/BRi_l7vUdpb93Knf.jpg,1,3,Dingo,0.160753,False
875021211251597312,2017-06-14 16:04:48,Twitter for iPhone,Guys please stop sending pictures without any dogs in th- oh never mind hello excuse me sir. 12/10 stealthy as h*ck,"https://twitter.com/dog_rates/status/875021211251597312/photo/1,https://twitter.com/dog_rates/status/875021211251597312/photo/1",12.0,dog doe,06-14-2017,2,unknown,4495,24638,https://pbs.twimg.com/media/DCSzF3NVoAAPzT4.jpg,2,1,West Highland White Terrier,0.7143189999999999,True
875021211251597312,2017-06-14 16:04:48,Twitter for iPhone,Guys please stop sending pictures without any dogs in th- oh never mind hello excuse me sir. 12/10 stealthy as h*ck,"https://twitter.com/dog_rates/status/875021211251597312/photo/1,https://twitter.com/dog_rates/status/875021211251597312/photo/1",12.0,dog doe,06-14-2017,2,unknown,4495,24638,https://pbs.twimg.com/media/DCSzF3NVoAAPzT4.jpg,2,2,Siberian Husky,0.0919133,True
875021211251597312,2017-06-14 16:04:48,Twitter for iPhone,Guys please stop sending pictures without any dogs in th- oh never mind hello excuse me sir. 12/10 stealthy as h*ck,"https://twitter.com/dog_rates/status/875021211251597312/photo/1,https://twitter.com/dog_rates/status/875021211251597312/photo/1",12.0,dog doe,06-14-2017,2,unknown,4495,24638,https://pbs.twimg.com/media/DCSzF3NVoAAPzT4.jpg,2,3,Great Pyrenees,0.0460382,True
874680097055178752,2017-06-13 17:29:20,Twitter for iPhone,Meet Cash. He hath acquired a stick. A very good stick tbh. 12/10 would pat head approvingly,https://twitter.com/dog_rates/status/874680097055178752/photo/1,12.0,Cash,06-13-2017,1,unknown,4419,26925,https://pbs.twimg.com/media/DCN85nGUwAAzG_q.jpg,1,1,Labrador Retriever,0.836052,True
874680097055178752,2017-06-13 17:29:20,Twitter for iPhone,Meet Cash. He hath acquired a stick. A very good stick tbh. 12/10 would pat head approvingly,https://twitter.com/dog_rates/status/874680097055178752/photo/1,12.0,Cash,06-13-2017,1,unknown,4419,26925,https://pbs.twimg.com/media/DCN85nGUwAAzG_q.jpg,1,2,Staffordshire Bullterrier,0.0470691,True
874680097055178752,2017-06-13 17:29:20,Twitter for iPhone,Meet Cash. He hath acquired a stick. A very good stick tbh. 12/10 would pat head approvingly,https://twitter.com/dog_rates/status/874680097055178752/photo/1,12.0,Cash,06-13-2017,1,unknown,4419,26925,https://pbs.twimg.com/media/DCN85nGUwAAzG_q.jpg,1,3,Beagle,0.0360071,True
874296783580663808,2017-06-12 16:06:11,Twitter for iPhone,This is Jed. He may be the fanciest pupper in the game right now. Knows it too. 13/10 would sign modeling contract,https://twitter.com/dog_rates/status/874296783580663808/photo/1,13.0,Jed,06-12-2017,0,pupper,3919,25205,https://pbs.twimg.com/media/DCIgSR0XgAANEOY.jpg,1,1,Cocker Spaniel,0.437216,True
874296783580663808,2017-06-12 16:06:11,Twitter for iPhone,This is Jed. He may be the fanciest pupper in the game right now. Knows it too. 13/10 would sign modeling contract,https://twitter.com/dog_rates/status/874296783580663808/photo/1,13.0,Jed,06-12-2017,0,pupper,3919,25205,https://pbs.twimg.com/media/DCIgSR0XgAANEOY.jpg,1,2,Miniature Poodle,0.277191,True
874296783580663808,2017-06-12 16:06:11,Twitter for iPhone,This is Jed. He may be the fanciest pupper in the game right now. Knows it too. 13/10 would sign modeling contract,https://twitter.com/dog_rates/status/874296783580663808/photo/1,13.0,Jed,06-12-2017,0,pupper,3919,25205,https://pbs.twimg.com/media/DCIgSR0XgAANEOY.jpg,1,3,Toy Poodle,0.157402,True
874057562936811520,2017-06-12 00:15:36,Twitter for iPhone,"I can't believe this keeps happening. This, is a birb taking a bath. We only rate dogs. Please only send dogs. Thank you... 12/10",https://twitter.com/dog_rates/status/874057562936811520/photo/1,12.0,dog doe,06-12-2017,0,unknown,3768,21975,https://pbs.twimg.com/media/DCFGtdoXkAEsqIw.jpg,1,1,Flat Coated Retriever,0.8321770000000001,True
874057562936811520,2017-06-12 00:15:36,Twitter for iPhone,"I can't believe this keeps happening. This, is a birb taking a bath. We only rate dogs. Please only send dogs. Thank you... 12/10",https://twitter.com/dog_rates/status/874057562936811520/photo/1,12.0,dog doe,06-12-2017,0,unknown,3768,21975,https://pbs.twimg.com/media/DCFGtdoXkAEsqIw.jpg,1,2,Black And Tan Coonhound,0.040436900000000005,True
874057562936811520,2017-06-12 00:15:36,Twitter for iPhone,"I can't believe this keeps happening. This, is a birb taking a bath. We only rate dogs. Please only send dogs. Thank you... 12/10",https://twitter.com/dog_rates/status/874057562936811520/photo/1,12.0,dog doe,06-12-2017,0,unknown,3768,21975,https://pbs.twimg.com/media/DCFGtdoXkAEsqIw.jpg,1,3,Newfoundland,0.0282283,True
874012996292530176,2017-06-11 21:18:31,Twitter for iPhone,"This is Sebastian. He can't see all the colors of the rainbow, but he can see that this flag makes his human happy. 13/10 #PrideMonth puppo","https://twitter.com/dog_rates/status/874012996292530176/photo/1,https://twitter.com/dog_rates/status/874012996292530176/photo/1",13.0,Sebastian,06-11-2017,6,puppo,9859,33418,https://pbs.twimg.com/media/DCEeLxjXsAAvNSM.jpg,2,1,Cardigan,0.806674,True
874012996292530176,2017-06-11 21:18:31,Twitter for iPhone,"This is Sebastian. He can't see all the colors of the rainbow, but he can see that this flag makes his human happy. 13/10 #PrideMonth puppo","https://twitter.com/dog_rates/status/874012996292530176/photo/1,https://twitter.com/dog_rates/status/874012996292530176/photo/1",13.0,Sebastian,06-11-2017,6,puppo,9859,33418,https://pbs.twimg.com/media/DCEeLxjXsAAvNSM.jpg,2,2,Pembroke,0.116622,True
874012996292530176,2017-06-11 21:18:31,Twitter for iPhone,"This is Sebastian. He can't see all the colors of the rainbow, but he can see that this flag makes his human happy. 13/10 #PrideMonth puppo","https://twitter.com/dog_rates/status/874012996292530176/photo/1,https://twitter.com/dog_rates/status/874012996292530176/photo/1",13.0,Sebastian,06-11-2017,6,puppo,9859,33418,https://pbs.twimg.com/media/DCEeLxjXsAAvNSM.jpg,2,3,Kelpie,0.0491819,True
873580283840344065,2017-06-10 16:39:04,Twitter for iPhone,"We usually don't rate Deck-bound Saskatoon Black Bears, but this one is h*ckin flawless. Sneaky tongue slip too. 13/10 would hug firmly",https://twitter.com/dog_rates/status/873580283840344065/photo/1,13.0,dog doe,06-10-2017,5,unknown,3754,23451,https://pbs.twimg.com/media/DB-UotKXkAEHXVi.jpg,1,1,Newfoundland,0.678537,True
873580283840344065,2017-06-10 16:39:04,Twitter for iPhone,"We usually don't rate Deck-bound Saskatoon Black Bears, but this one is h*ckin flawless. Sneaky tongue slip too. 13/10 would hug firmly",https://twitter.com/dog_rates/status/873580283840344065/photo/1,13.0,dog doe,06-10-2017,5,unknown,3754,23451,https://pbs.twimg.com/media/DB-UotKXkAEHXVi.jpg,1,2,Tibetan Mastiff,0.244022,True
873580283840344065,2017-06-10 16:39:04,Twitter for iPhone,"We usually don't rate Deck-bound Saskatoon Black Bears, but this one is h*ckin flawless. Sneaky tongue slip too. 13/10 would hug firmly",https://twitter.com/dog_rates/status/873580283840344065/photo/1,13.0,dog doe,06-10-2017,5,unknown,3754,23451,https://pbs.twimg.com/media/DB-UotKXkAEHXVi.jpg,1,3,Chow,0.0485295,True
873213775632977920,2017-06-09 16:22:42,Twitter for iPhone,"This is Sierra. She's one precious pupper. Absolute 12/10. Been in and out of ICU her whole life. Help Sierra below
","https://www.gofundme.com/help-my-baby-sierra-get-better,https://twitter.com/dog_rates/status/873213775632977920/photo/1,https://twitter.com/dog_rates/status/873213775632977920/photo/1",12.0,Sierra,06-09-2017,4,pupper,1517,6976,https://pbs.twimg.com/media/DB5HTBGXUAE0TiK.jpg,1,1,Vizsla,0.6197819999999999,True
873213775632977920,2017-06-09 16:22:42,Twitter for iPhone,"This is Sierra. She's one precious pupper. Absolute 12/10. Been in and out of ICU her whole life. Help Sierra below
","https://www.gofundme.com/help-my-baby-sierra-get-better,https://twitter.com/dog_rates/status/873213775632977920/photo/1,https://twitter.com/dog_rates/status/873213775632977920/photo/1",12.0,Sierra,06-09-2017,4,pupper,1517,6976,https://pbs.twimg.com/media/DB5HTBGXUAE0TiK.jpg,1,2,Bloodhound,0.338069,True
873213775632977920,2017-06-09 16:22:42,Twitter for iPhone,"This is Sierra. She's one precious pupper. Absolute 12/10. Been in and out of ICU her whole life. Help Sierra below
","https://www.gofundme.com/help-my-baby-sierra-get-better,https://twitter.com/dog_rates/status/873213775632977920/photo/1,https://twitter.com/dog_rates/status/873213775632977920/photo/1",12.0,Sierra,06-09-2017,4,pupper,1517,6976,https://pbs.twimg.com/media/DB5HTBGXUAE0TiK.jpg,1,3,Chesapeake Bay Retriever,0.0126763,True
872967104147763200,2017-06-09 00:02:31,Twitter for iPhone,Here's a very large dog. He has a date later. Politely asked this water person to check if his breath is bad. 12/10 good to go doggo,"https://twitter.com/dog_rates/status/872967104147763200/photo/1,https://twitter.com/dog_rates/status/872967104147763200/photo/1",12.0,dog doe,06-09-2017,4,doggo,5160,26449,https://pbs.twimg.com/media/DB1m871XUAAw5vZ.jpg,2,1,Labrador Retriever,0.476913,True
872967104147763200,2017-06-09 00:02:31,Twitter for iPhone,Here's a very large dog. He has a date later. Politely asked this water person to check if his breath is bad. 12/10 good to go doggo,"https://twitter.com/dog_rates/status/872967104147763200/photo/1,https://twitter.com/dog_rates/status/872967104147763200/photo/1",12.0,dog doe,06-09-2017,4,doggo,5160,26449,https://pbs.twimg.com/media/DB1m871XUAAw5vZ.jpg,2,2,Chesapeake Bay Retriever,0.174145,True
872967104147763200,2017-06-09 00:02:31,Twitter for iPhone,Here's a very large dog. He has a date later. Politely asked this water person to check if his breath is bad. 12/10 good to go doggo,"https://twitter.com/dog_rates/status/872967104147763200/photo/1,https://twitter.com/dog_rates/status/872967104147763200/photo/1",12.0,dog doe,06-09-2017,4,doggo,5160,26449,https://pbs.twimg.com/media/DB1m871XUAAw5vZ.jpg,2,3,German Short Haired Pointer,0.0928614,True
872820683541237760,2017-06-08 14:20:41,Twitter for iPhone,"Here are my favorite #dogsatpollingstations 
Most voted for a more consistent walking schedule and to increase daily pats tenfold. All 13/10","https://twitter.com/dog_rates/status/872820683541237760/photo/1,https://twitter.com/dog_rates/status/872820683541237760/photo/1,https://twitter.com/dog_rates/status/872820683541237760/photo/1,https://twitter.com/dog_rates/status/872820683541237760/photo/1",13.0,dog doe,06-08-2017,3,unknown,3542,14253,https://pbs.twimg.com/media/DBzhx0PWAAEhl0E.jpg,3,1,Pug,0.99912,True
872820683541237760,2017-06-08 14:20:41,Twitter for iPhone,"Here are my favorite #dogsatpollingstations 
